text	page_id	page_title	page_revisions	chars
"Il delfino ha una specie di ""becco"" chiamato rostro che usa per difendersi. La bocca del delfino scientificamente si chiama ""rima boccale"" che è diversa dal piccolo buco che ha sopra la fronte che invece si chiama ""sfiatatoio"", che gli serve per espirare. La zona anteriore dorsale finisce con la ""pinna pettorale"", che è fondamentale per la sopravvivenza dei delfini. Passando dopo alla parte anteriore ventrale, come si può capire da nome, troviamo il ventre, cioè la pancia e, sempre nella stessa zona, c'è l'ombelico, la fessura genitale, che è indispensabile per la riproduzione, l'ano, che serve per il sistema digerente e, solo nelle femmine, ci sono le fessure mammarie laterali, che servono anche questi per la riproduzione. Sopra la zona anteriore ventrale c'è la zona posteriore dorsale, dove si trova la pinna dorsale, di cui il compito principale è evitare il capovolgimento dei delfini e aiutarli nei cambi di direzione improvvisi. Infine nella zona posteriore ventrale si può osservare la pinna caudale, parte fondamentale sul corpo dei delfini, che fa parte del peduncolo caudale."	18185	Delfino	94	1096
È circondato ad Est dal mare del Nord, a Sud dal canale della Manica, a Nord-Ovest dall'Oceano Atlantico, al centro-Ovest dal mare d'Irlanda, e a Sud-Ovest dal Mare celtico.Il Regno Unito si trova nell'arcipelago britannico ed è costituito dalla Gran Bretagna, escludendo l'Irlanda del Nord.	5580	Regno_Unito	96	291
Il territorio britannico è prevalentemente pianeggiante.Le maggiori catene montuose sono i Monti Grampiani nella Scozia centrale, che raggiungono i 1344 m sul livello del mare, e i Monti Cambrici nel Galles centrale che superano di poco i 900 m.Nell'Inghilterra settentrionale c'è una catena composta sia da montagne che da colline: i Monti Pennini, che raggiungono gli 893 m.	5580	Regno_Unito	96	376
I fiumi più lunghi sono il Tamigi e il Severn, a Sud.Questi fiumi sono navigabili, sfociano in un estuario e intersecati da molti canali artificiali.I laghi più estesi si trovano nell'Irlanda del Nord, dove è presente il Lago Neagh, il più esteso dell'arcipelago britannico, e nel Lakeland, nell'Inghilterra nord-occidentale.Gli arcipelaghi più importanti sono le Isole Orcadi e le Isole Shetland a Nord, e le Isole Ebridi a Nord-Ovest.	5580	Regno_Unito	96	436
Il Regno Unito è uno dei Paesi europei più popolati (63 000 000 ab. circa) è più densamente popolati (256 ab./km² in media, 360 ab./km² in zone di pianura).Nelle aree montruose vive l'1% della popolazione.Il tasso di natalità si è abbassato intorno al 2011; le persone con più di 65 anni d'età costituiscono più del 20% della popolazione.	5580	Regno_Unito	96	338
La percentuale degli addetti sull'agricoltura costituisce l'1% della forza lavoro. Comuni sono le coltivazioni di luppolo, di barbabietole da zuccchero e di cereali. Gli allevamenti più redditizi sono l'ovinicoltura, da cui si ricava lana pregiata, la bovinicoltura e la suinicoltura.	5580	Regno_Unito	96	284
Londra è sede della seconda borsa dei valori dopo quella di Nuova York, di importati istituti bancari e finanziari e della più importante compagnia d'assicurazione del mondo, i Lloyd's di Londra. Importanti sono le attività commerciali e il turismo in crescita. Sono sviluppati i trasporti, specialmente quelli ferroviari, stradali e quelle idroviarie. I tunnel della Manica è una galleria scavata sotto La Manica che collega Il Regno Unito colla Francia. Il Regno Unito creò alla fine del Novecento il Commonwealth Britannico, un'organizzazione d'alcune delle ex colonie dell'Impero britannico il cui fine è il benessere comune degli Stati membri.	5580	Regno_Unito	96	648
Il Regno Unito possiede quattro Nazionali di calcio, una per ogni nazione costitutiva: la Nazionale di calcio dell'Inghilterra, la Nazionale di calcio della Scozia, la Nazionale di calcio del Galles e la Nazionale di calcio dell'Irlanda del Nord. Esiste anche una Nazionale di calcio del Regno Unito che prende parte esclusivamente al torneo olimpico di calcio, poiché il Comitato Olimpico Internazionale non prevede la suddivisione in quattro Nazionali come invece previsto dalla FIFA. La Nazionale di calcio dell'Inghilterra è stata campione del mondo nell'edizione del 1966 giocata in casa.	5580	Regno_Unito	96	593
Collocazione di Tolentino nella provincia di MacerataTolentino si trova al centro della vallata del fiume Chienti in un luogo territorialmente molto favorevole. La prima popolazione vissuta a Tolentino furono i Piceni; a conferma di questo, molti anni fa, è stato trovato un ciottolo, in cui era raffigurata una donna lupo, che probabilmente era risalente a quegli anni. La piazza più antica è quella della Libertà, che probabilmente era il foro romano, incrocio tra due strade: cardo e decumano. Tolentino ha avuto un forte sviluppo intorno al 1960 e la maggior parte della popolazione dall'interno e dalle campagne è venuta ad abitare in città. L'attuale sindaco è Mauro Sclavi.	8971	Tolentino	100	680
Il gemellaggio è un legame politico o/e culturale fatto tra due città. Tolentino è gemellato con Labastide-Murat (Francia), Émerainville (Francia), Isola d'Istria (Slovenia), Scigliano (provincia di Cosenza) e Castello di Serravalle (provincia di Bologna, ora Valsamoggia gemellaggio ancora da completare). Le città che si sono gemellate con Tolentino hanno dato il nome a vie o parchi della città, ad esempio il parco Isola d'Istria oppure il viale Labastide-Murat.	8971	Tolentino	100	466
In passato, i ragazzi e le ragazze nel tempo libero, si riunivano in giardini, piazze, oratori o alla stazione. Questi luoghi erano scelti perché considerati sicuri visto che non c'erano molte auto in giro, non c’era neanche molta possibilità di spostarsi; i ragazzi venivano controllati dai propri genitori, parenti e amici, infatti, vista la poca popolazione, si conoscevano tutti. Le ragazze amavano sedersi sui muretti, anche perché si potevano fare nuove amicizie, mentre i maschi, giravano con le bici.	8971	Tolentino	100	508
Alle elementari, i ragazzi giocavano con le figurine Panini. Si giocava anche con le biglie, per le quali venivano costruite apposite piste e a calcio nell'oratorio San Catervo, ma si facevano anche giochi di squadra come: tiro alla fune, pallacanestro, pallavolo e biliardino. Si poteva passeggiare, andare a vedere le mostre di pittura e volendo, partecipare anche ai gruppi Scout.	8971	Tolentino	100	383
I bambini si divertivano a costruire delle capanne di legno che servivano da rifugio. Un gioco molto divertente era quello di prendere con la bocca una mela, mentre si avevano le mani legate per metterla in un altro recipiente. A 13/14 anni, se si voleva ascoltare la musica, si andava a casa di amici, dove si mettevano i dischi, si mangiavano cioccolatini e si poteva anche ballare.	8971	Tolentino	100	384
Quando pioveva, ci si ritrovava a casa di un amico o negli oratori, dove si facevano i giochi da tavolo. La sera era raro che i ragazzi uscissero. Un altro luogo dove ci si poteva divertire era il parco delle Terme di S. Lucia visto che si trova fuori Tolentino vi si accedeva solo se accompagnati da nonni o genitori.	8971	Tolentino	100	318
"Al giorno d’oggi non ci si incontra più di persona come un tempo. Quando i ragazzi escono a Tolentino si riuniscono: al parco isola d’Istria nei pressi la pizzeria, vicino alla fontana di San Nicola, nei parchi anche fuori dal centro storico; adesso è frequentatissimo il McDonald's aperto da poco. I giovani di oggi amano molto andare in discoteca, adesso ce ne sono diverse in provincia, ma a quel tempo la più rinomata, per i ragazzi di Tolentino degli anni '80, era quella che si trovava vicino l’ex Hotel 77, in Viale Bruno Buozzi, chiamata “Imagine” e quella nei pressi delle Grazie chiamata ""Bussola"". Molto frequentato è anche lo Sherlock Holmes, un risto-pub."	8971	Tolentino	100	668
"Fino a circa metà del 1900, la piazza principale aveva un ruolo sociale molto importante per i tolentinati: era il luogo dove si socializzava e dove spesso si stringevano gli ""affari"" tra le varie categorie sociali. Oggi questo luogo verrebbe chiamato ""area di networking""."	8971	Tolentino	100	273
"Al giorno d’oggi, oltre alle piattaforme televisive, per la fornitura di serie TV e film, c’è anche una multisala, chiamata Giometti, posta vicino al centro commerciale Oasi. Un tempo, se si volevano vedere film su grandi schermi, si potevano frequentare: il cinema Europa, vicino al parco John Lennon, ora sede di una banca. Prima era la sala che proiettava i film in prima visione e quindi meta di tante persone anche dell'entroterra. C'era anche il cinema Politeama, recentemente restaurato, che, oltre alle proiezioni, proponeva anche spettacoli di arte varia. Infine c'era il cinema dell'oratorio Don Bosco, che, dal settembre del 1991, iniziò la domenica pomeriggio le proiezioni degli spettacolari ""spaghetti"" western. Alcuni dei più affezionati ricordano con nostalgia l'intervallo tra il 1° e 2° tempo quando si acquistavano i pop-corn con la gazzosa aromatizzata alla menta...oggi banalmente Sprite!"	8971	Tolentino	100	918
"A Natale si faceva un grande pranzo, la cui portata principale erano i cappelletti e tortellini rigorosamente in brodo, fatto con il cappone grasso. Dopo il primo si mangiava il ""lesso"", cioè il cappone utilizzato per fare il brodo veniva accompagnato con erbe cotte o con insalata russa. Il lesso poteva essere fatto anche con altri tipi di carne. Per dolce veniva fatta la pizza di Natale con noci, fichi, pinoli e un po’ di cacao per renderla scura. Nelle nostre campagne era una festa quando si faceva la polenta sulla “spianatora”, una specie di tavola alla quale tutti attingevano e sulla quale veniva messa la polenta, condita con sugo o bianca con funghi e salsicce. <gallery>"	8971	Tolentino	100	684
Il numero romano è uno dei sistemi della matematica inventata dai tempi dell'Antica Roma. Gli antichi romani inventarono un sistema di numerazione che è detto additivo perché i valori dei simboli si sommano o si sottraggono secondo criteri specifici.	8811	Numero_romano	100	250
Il Sacro Romano Impero fu uno Stato antico, formato da un agglomerato di territori, che occupava una parte dell'Europa centrale ed occidentale. Esso nacque durante l'alto Medioevo (962 circa) e continuò ad esistere per circa un millennio (fino al 1806 circa) (*) .	10631	Sacro_Romano_Impero	100	264
Come anno di fondazione del Sacro Romano Impero si considera generalmente il 962, anno dell'incoronazione di Ottone I. Buona parte della storiografia di lingua italiana, tuttavia, è solita includere anche l'Impero carolingio (cioè sotto la guida di Carlo Magno) all'interno della storia del Sacro Romano Impero, facendone quindi coincidere l'inizio con l'incoronazione di Carlo Magno nell'anno 800. Però, a differenza dell'impero carolingio, l'impero di Ottone era limitato all'area germanica e all'Italia settentrionale. La dinastia ottoniana regnò sull'impero fino al 1024, riuscendo ad annettere la Boemia. In seguito salì al trono la dinastia salica, che conquistò la Borgogna, rendendo così l'impero una monarchia composta da 4 blocchi: Germania, Italia (del nord), Boemia e Borgogna (*) .	10631	Sacro_Romano_Impero	100	794
La fama dell'Impero quasi però si estinse durante la lotta per le investiture (1073-1122), combattuta tra papa Gregorio VII e l'imperatore Enrico IV e riguardante il diritto di eleggere i vescovi-conti e il papa stesso. Durante essa il pontefice scomunicò l'imperatore. Enrico IV, così, per far fronte alle rivolte nell'impero causate dalla scomunica, decise di chiedere perdono al papa, recandosi a Canossa. L'imperatore fu costretto però ad attendere 3 giorni e 3 notti, ma dopo questa umiliazione (detta umiliazione di Canossa) papa Gregorio VII revocò la scomunica. Ritornato in Germania, convocò un'assemblea di vescovi filo imperiali, eleggendo un antipapa, Clemente III. Papa Gregorio VII lo scomunicò nuovamente, ma l'imperatore fece invadere Roma nel 1083. Gregorio VII chiese l'aiuto dei normanni, che sconfissero le truppe imperiali. I normanni però saccheggiarono Roma: gli abitanti ritennero colpevole il papa, che fu costretto all'esilio a Salerno, dove morirà l'anno dopo. La lotta termina nel 1122 con il concordato di Worms, firmato tra Enrico V e papa Callisto II; esso sancì che i vescovi fossero nominati dal clero locale e che fossero investiti dal pontefice.	10631	Sacro_Romano_Impero	100	1180
Nel 1138 salì al trono Corrado III, il primo imperatore della casata Hohenstaufen. Con suo figlio, Federico Barbarossa, fu ristabilita l'autorità imperiale in Germania. Intanto, però, nell'Italia del Nord, si andavano a formare i Comuni, ovvero associazioni di nobili, mercanti e rappresentanti delle corporazioni degli artigiani, dotate di un parlamento cittadino detto arengo. I Comuni volevano l'indipendenza dall'imperatore, ma egli, durante la dieta di Roncaglia (1154), rivendicò tutti i diritti imperiali (regalie), riaffermando così gli obblighi dei vassalli.	10631	Sacro_Romano_Impero	100	567
Nel 1156 Federico Barbarossa assediò il comune di Milano, che si stava espandendo a danno di altri centri abitati; ma nel 1167 le città lombarde si allearono tra loro formando la Lega lombarda, che nel 1176 sconfisse l'esercito imperiale a Legnano. Nel 1183, così, Federico Barbarossa, sconfitto, firmò la pace di Costanza, attraverso cui riconobbe ampia autonomia ai Comuni. Il figlio di barbarossa, Enrico VI, sposò Costanza d'Altavilla, regina di Sicilia, unendo così i domini imperiali al regno di Sicilia. Dalla loro unione nacque, nel 1194, Federico II. Egli divenne re di Germania nel 1212 e imperatore nel 1220; Nel 1228 riuscì ad impossessarsi di Gerusalemme durante la sesta crociata, e nel 1229 venne incoronato Re di Gerusalemme. In seguito Federico II si occupò di trasformare il regno di Sicilia in uno stato moderno, promulgando nel 1231 la costituzione di Melfi. In questo modo l'imperatore affermava la sua superiorità sui baroni , sui comuni e sulla Chiesa.	10631	Sacro_Romano_Impero	100	975
A differenza del Mezzogiorno, però in Nord Italia i comuni erano diventate delle realtà politiche ed economiche che non volevano rinunciare alla loro autonomia. Così, quando Federico II cerco di imporre la sua autorità, i comuni reagiscono formando una Lega, che venne comunque battuta dall'esercito imperiale a Cortenuova nel 1237. Nonostante la sconfitta, i comuni si allearono con papa Gregorio IX e il contrasto tra papato e impero si fece ancora più acceso con papa Innocenzo IV. Egli nel 1245 convoca un concilio a Lione dove dichiara deposto Federico II, scomunicandolo. Così i feudatari tedeschi si ribellarono e nominarono un nuovo sovrano, mentre i Comuni ottennero due vittorie contro le truppe imperiali: a Parma (1248) e a Fossalta (1249). Federico morì nel 1250 e con lui tramontò l'idea di costruire un impero universale.	10631	Sacro_Romano_Impero	100	836
"Nel 1356 l'imperatore Carlo IV di Lussemburgo emanò la bolla d'Oro, un documento che sancì la procedura dell'elezione dell'imperatore riducendo il numero di elettori a 7: queste persone erano dette principi elettori. 4 erano laici (re di Boemia, duca di Sassonia, margravio del Brandeburgo e conte del Palatinato), mentre i restanti 3 erano ecclesiastici (arcivescovi di Colonia, Magonza e Treviri). L’elezione avveniva a Francoforte sul Meno, l’incoronazione nella citta di Aquisgrana. Con questa nuova modalità di elezione ci si svincolò dal potere papale, ma si dovevano privilegi territoriali e nobiliari agli elettori , e ciò causo un indebolimento deo potere dell'imperatore. Nel 1452, Federico III fu il primo Asburgo ad essere incoronato Sacro Romano Imperatore. Da ora in avanti, il titolo di sacro romano imperatore, diviene ""proprietà"" della casata degli Asburgo."	10631	Sacro_Romano_Impero	100	874
Nel XVI secolo si ha l'ultimo tentativo di riunire sotto un unico imperatore un grande impero occidentale. Nel 1519 Carlo V divenne imperatore del Sacro romano impero grazie all'ereditarietà dinastica: ereditò dalla nonna paterna i Paesi Bassi, e, essendo nipote dell'imperatore Massimiliano I, poté candidarsi per il trono imperiale che riuscì a ottenere corrompendo i principi tedeschi elettori; così nel 1519 diventò imperatore d'Austria, Germania, Ungheria, Boemia e Paesi Bassi. Dal 1516 era anche re di Spagna e dei domini americani, di Napoli, della Sicilia e della Sardegna, ereditati dalla madre Giovanna di Castiglia. Carlo V si ritrova a essere così il sovrano più potente d'Europa, e durante il suo regno combatte contro la Francia di Francesco I, che si ribella all'accerchiamento dell'impero di Carlo V . Francia e Sacro romano impero si scontrarono in una serie di guerre che si svolsero in Italia: infatti sia Francesco I sia Carlo V volevano appropriarsi del Ducato di Milano. La prima guerra (1521-25), terminò a favore dell'imperatore con la vittoria di Pavia, dove re Francesco I fu fatto prigioniero. Ci fu una seconda campagna, in cui il nuovo papa, Clemente VII, preoccupato dalla possibilità che Carlo V assumesse il controllo della penisola, si riavvicinò a Francesco I e nel 1526 formò la lega di Cognac con la repubblica di Venezia, la repubblica di Genova, il duca di Milano Francesco II Sforza e il re d'Inghilterra, Enrico VIII. Allora Carlo V mando in Italia un'armata di Lanzichenecchi, che causarono il sacco di Roma il 6 maggio 1527: ancora una volta l'imperatore uscì vincente, e riuscì ad ottenere il ducato di Milano con la pace di Cambrai (1530), anche se dovette cedere la Borgogna alla Francia.	10631	Sacro_Romano_Impero	100	1734
All'inizio del XVI secolo la Chiesa cattolica era corrotta e intanto papa Leone X aveva promulgato una vendita delle indulgenze (cioè una pratica che prevedeva che il fedele pagasse una somma di denaro perché la Chiesa cancellasse i suoi peccati davanti a Dio) per terminare i lavori della basilica di San Pietro. Nel 1517 un monaco tedesco, Martin Lutero, sconvolto dalla corruzione ecclesiastica, scrisse 95 tesi , in cui condannò la vendita delle indulgenze, e il 31 ottobre di quell'anno le affisse alla porta della cattedrale di Wittemberg , dando così inizio alla riforma protestante.	10631	Sacro_Romano_Impero	100	590
Nel 1521 Martin Lutero viene scomunicato dal papa e lo stesso anno, durante la dieta di Worms Carlo V lo bandì dall'impero. Contemporaneamente però la riforma protestante si stava diffondendo in Germania, mentre Martin Lutero ottenne l'appoggio del principe Federico di Sassonia. Tutti i principi protestanti tedeschi, intenzionati a sottrarsi dall'autorità imperiale, (in seguito alle diete di Spira e di Augusta), si riunirono nella Lega di Smalcanda nel 1530 e combatterono contro Carlo V e i cattolici tedeschi fino al 1555, anno in cui venne stipulata la pace di Augusta. Essa sancì la divisione religiosa del Sacro Romano Impero: imponeva infatti che ogni suddito dovesse seguire la religione del sovrano. Il luteranesimo, oltre che nell'impero, si diffuse in Scandinavia e nei paesi baltici.	10631	Sacro_Romano_Impero	100	798
Il Sacro Romano Impero partecipo alla guerra dei trent'anni durata dal 1618 al 1648. Questa guerra di religione sconvolgerà il Sacro Romano Impero, che fu il paese belligerante che registrò le maggiori perdite demografiche. Dopo la pace di Vestfalia, il Sacro romano impero apparì come una confederazione composta da oltre 300 stati tedeschi posti sotto il controllo degli Asburgo d'Austria.	10631	Sacro_Romano_Impero	100	391
Durante il XVIII secolo il Sacro romano impero esisteva ancora con una dieta ubicata a Ratisbona, ma l'autorità imperiale era debole e incapace di controllare le zone più periferiche. Durante il 1700 le maggiori potenze all'interno dell'impero erano la Prussia e gli Asburgo d'Austria. Nel XVIII secolo, il re di Prussia Federico II contestava, la superiorità austriaca. Durante questo secolo il Sacro Romano Impero combatté in diverse guerre, come la guerra di successione spagnola e la guerra dei sette anni.	10631	Sacro_Romano_Impero	100	510
Fu formalmente dissolto il 6 agosto 1806 sotto la guida di Francesco II d'Asburgo-Lorena a seguito dell'intervento di Napoleone Bonaparte. Francesco abdicò, accontentandosi del titolo di imperatore d'Austria, ottenuto nel 1804 col nome di Francesco I. Il Sacro Romano Impero venne sostituito dalla confederazione del Reno, una confederazione fondata da Napoleone Bonaparte e formata da 39 stati.	10631	Sacro_Romano_Impero	100	395
Quando venne fondato da Ottone I, era esteso 800000 km². Durante il Medioevo, Il Sacro Romano Impero si estendeva sui territori che oggi formano la Germania, la Svizzera, l'Austria, la Repubblica Ceca, i Paesi Bassi, il Lussemburgo, il Belgio, l'est e il sud-est della Francia, l'Italia settentrionale e centrale. Durante l'età moderna perse molti territori, fino ad arrivare a comprendere nel 1789 (la vigilia della rivoluzione francese) solo Germania, Austria, Repubblica Ceca, Slovenia, Trentino-Alto Adige e Belgio.	10631	Sacro_Romano_Impero	100	519
L'economia dello stato antico era prevalentemente agricola e da allevamento. Spesso i contadini erano servi della terra di un vassallo o di un valvassore che in cambio riscuoteva delle tasse sia per l'imperatore sia per l'esercito alla difesa del territorio dell'Impero contro i Saraceni; che di seguito è in parte storica delle guerre chiamate Crociate. Le monete del periodo erano chiamate talleri.	10631	Sacro_Romano_Impero	100	400
La Svizzera è l'unico Stato al mondo che ha una forma di governo (*) chiamato repubblica direttoriale (*) o confederato, cioè il Cantone è uno Stato all'interno di un altro Stato (*) ed i capi di Stato ha il mandato che dura un solo anno, mentre il Capo di Governo è eletto dall'Assemblea Nazionale e il mandato dura circa 4 anni (*) (*) .	6761	Repubblica	100	339
Gli Asburgo d'Austria sono stati una delle dinastie più potenti e influenti nella storia europea. Essi regnarono all'inizio in Svizzera, per poi passare al Ducato d'Austria e infine furono alla guida del Sacro Romano Impero e dell'Arciducato d'Austria dal XV al XVIII secolo. Gli Asburgo d'Austria si assicurarono la continuazione della casa con gli Asburgo-Lorena.	35580	Asburgo_d'Austria	100	365
sinistra La famiglia degli Asburgo ha origini nobili in Svizzera, con il castello di Habsburg (Castello del falco) che segna il punto di partenza della loro epopea. Il primo membro della casata fu probabilmente il conte Guntram, che nel 950 si ribellò a Ottone I di Sassonia, mentre il vero fondatore della casata fu suo nipote, il conte Radbot.Radbot Egli costruì nel 1020 (insieme al vescovo di Strasburgo Werner I) il castello di Habsburg lungo il fiume Aar, nell'Argovia, in Svizzera. Il figlio di Radbot, Werner II, fu il primo a portare il titolo di Conte d'Asburgo (1082 circa), mentre suo nipote Alberto III il Ricco (morto nel 1199) era Conte d'Asburgo e langravio di Alsazia. Rodolfo II (1168-1232) , anch'egli conte d'Asburgo, ottenne il Laufenburg e il Waldstätte (cantoni di Schwyz, Uri, Unterwalden e Lucerna). Alla sua morte, avvenuta nel 1232, i suoi figli Alberto IV e Rodolfo III si divisero i territori. Si originarono così due linee distinte: quella principale, incominciata con Alberto IV, e quella di Laufenburg, iniziata con Rodolfo III, che si estinse nel 1408. La dinastia principale continuo con il figlio di Alberto, Rodolfo IV. Egli estese i suoi domini in Svizzera e nel 1273 fu incoronato sovrano del Sacro Romano Impero con il nome di Rodolfo I d'Asburgo, regnando fino al 1291. Durante il corso del suo regno Rodolfo fu impegnato in una guerra contro Ottocaro re di Boemia e nel 1276 firmò con lui la pace di Vienna, attraverso cui Ottocaro avrebbe ceduto a Rodolfo l'Austria e la Stiria.	35580	Asburgo_d'Austria	100	1520
La tregua pero non durò molto e le ostilità ricominciarono, anche se Ottocaro fu definitivamente sconfitto nella battaglia di Marchfeld. Così nel 1282 Rodolfo I d'Asburgo poté investire i suoi figli Alberto e Rodolfo II dei titoli ducali di Austria e di Stiria: in questo modo il fulcro degli Asburgo si spostò nel sud-est del Sacro Romano Impero, ovvero in Austria. Dopo Rodolfo I governò sull'impero romano-germanico suo figlio Alberto I, che regno dal 1298 al 1308. Dopo l'assassinio di Alberto I e la sconfitta durante la Battaglia di Mühldorf (1321) di suo figlio Federico I il Bello si fermò l'ascesa asburgica al trono imperiale: Federico fu ridotto così a duca D'Austria, titolo che dovette condividere con il fratello Leopoldo I. Ma gli Asburgo non si arresero e consolidarono i loro territori, che furono arricchiti da altre conquiste: Carinzia e Carniola furono acquisite nel 1335 grazie ad Alberto II; Il Tirolo fu conquistato nel 1364 sotto Rodolfo IV, mentre Trieste fu invece ottenuta nel 1382. La tregua pero non durò molto e le ostilità ricominciarono Nel 1364, Rodolfo IV d'Asburgo firmò con i suoi fratelli minori un patto che riconosceva il principio di uguaglianza dei diritti ma che in realtà garantiva la supremazia al capo della casata. Nonostante questo, dopo la sua morte i fratelli Alberto III e Leopoldo III d'Austria stipularono una spartizione mediante il Trattato di Neuberg (1379): Alberto prese l'Austria, mentre Leopoldo prese la Stiria, la Carinzia e il Tirolo.	35580	Asburgo_d'Austria	100	1496
Il Sacro Romano Impero, sotto la leadership degli Asburgo, fu un'entità politica complessa e multietnica, che si estendeva dalla Germania centrale fino all'Europa orientale. I monaci e i principi elettori avevano un ruolo significativo nella selezione dell'Imperatore, e gli Asburgo riuscirono a mantenere il trono imperiale in gran parte della loro storia.	35580	Asburgo_d'Austria	100	357
