text	page_id	page_title	page_revisions	chars
La lingua autoctona di Milano è un dialetto occidentale della Lingua lombarda, ossia il dialetto milanese. Questo dialetto conserva le caratteristiche generali della lingua lombarda, ma le principali differenze rispetto agli altri dialetti sono:	170	Milano	66	245
I vari tipi di olio possono essere: olio di oliva, olio di arachidi; olio ricco di vitamine E, olio di semi di girasole, olio di semi di mais, olio di palma e palmisti, olio di semi di lino; ricco di sali minerale, proteine, olio di cocco; viene ricavato attraverso l’essiccazione della polpa della noce di cocco, olio di semi di sesamo.	29886	Olio	67	337
I passaggi per la produzione dell'olio di oliva cominciano con la raccolta che avviene in autunno e si compie per mezzo di bastoni. Poi le olive vengono fatte lavare, arriva il passaggio della molitura e gramolatura, centrifugazione, stoccaggio ed infine imbottigliamento.	29886	Olio	67	272
Le olive devono essere ventilate per spostare polvere, rametti e foglie. Dopo le olive vengono lavate nell’acqua fredda per allontanare la terra; poi vengono passate su griglie vibranti per disperdere l’acqua e allontanare i sassi. Con alcuni tipi di frangitori bisogna separare tutti gli oggetti pesanti (sassi, pietre, pezzi metallici).	29886	Olio	67	338
E’ la fase fondamentale della produzione dell’olio, metodo più antico. Dopo la raccolta le olive vengono portate in frantoio, poi vengono messe nel defogliatore (serve per rimuovere foglie e rami). A questo punto le olive sono pronte per essere portate nel frantumatore che provoca una rottura e la fuoriuscita della pasta d’olio. Avviene con un macchinario chiamato molazza (macchina impastatrice e frantumatrice) costituita da una vasca con fondo in granito, e da 2 o più ruote, che effettuano un movimento rotatorio.	29886	Olio	67	519
Metodo più moderno, è una fase della produzione d’olio in cui la pasta delle olive viene trasferita in una gramola per poi essere sottoposta alla separazione tra acqua e olio. Alla gramolatura spetta il compito di determinare qualità e quantità dell’olio. Una normale gramolatura dura dai 20 ai 40 minuti, per non lasciare che il contatto della pasta d’olio con l’aria la ossidi eccessivamente. La gramola , da cui prende il nome la procedura, è una vasca in acciaio nella quale ruotano pale e grazie ad esse viene mescolata la pasta d’olio. Porta alla rottura della pasta.	29886	Olio	67	573
La Spagna è il paese di maggiore produzione di olive al mondo nel 2019. La produzione di olive in Spagna è concentrata principalmente nella regione dell'Andalusia. I dieci paesi con maggiore produzione di olive al mondo sono Spagna, Italia, Marocco, Turchia, Grecia, Egitto, Portogallo, Tunisia, Algeria e Siria.	29886	Olio	67	312
La maggior parte dei gruppi rock sono composte da quattro elementi, un quartetto solitamente formato da un chitarrista, un cantante, un bassista e un batterista. Esistono comunque anche formazioni più articolate, di cinque o più elementi, o meno articolate, con solo due o tre elementi. La ripartizione dei ruoli non rispetta inoltre uno standard e uno stesso musicista può ricoprire più ruoli all'interno di un gruppo musicale.	29970	Rock	67	428
Il territorio ligure si estende per 5.420 kmq e il 34,9% di questo è occupato da colli a differenza del 65,1% restante che è occupato dalla catena montuosa delle Alpi Liguri suddivisibili in Prealpi Liguri e Alpi dei Maguareis. Il rilievo più alto della Liguria è il Monte Saccarello alto 2200m, situato nelle Alpi dei Maguareis, al confine con il Piemonte ed il Dipartimento delle Alpi Marittime. Ci sono numerosi passi che mettono in comunicazione la Liguria con i suoi confini;i più importanti sono:	5708	Liguria	67	502
La floricoltura è un settore dell'agricoltura praticato in molte regioni ma soprattutto in Liguria. La città maggiormente conosciuta per questo tipo di attività è Sanremo, detta 'La Città dei Fiori'. Si tratta di una vera e propria città-giardino infatti non lontano dal tunnel che va dalla città di Bordighiera si trova un bellissimo giardino esotico, il quale ospita circa 3.000 specie di piante. Qui, inoltre, vengono coltivati circa l'80% di fiori a scopo commerciale.	5708	Liguria	67	472
Lungo la zona costiera sono presenti la ginestra, l'alterno, il lentisco, il mirto, il leccio, e tra i 600–800 m di altitudine si trovano piante molto rare come l'olivastro, il carrubo. In alture meno elevate si possono trovare arbusti aromatici come il timo, l'alloro e il rosmarino. Nelle zone meno protette dalle montagne vi è la gariga, formata da arbusti bassi e legnosi. Nelle fasce collinari e marittime sono prevalenti pinete di pino marittimo e in casi rari il pino d'Aleppo.	5708	Liguria	67	484
La fauna caratteristica ligure è costituita da specie che nel tempo sono state adattate sul territorio per la frammentazione dell'area di distribuzione. Gli animali presenti sono tipici del clima mediterraneo. Annoverano anche specie di più lontana origine sia nel tempo sia nel luogo. Nella Riviera di Ponente vi sono il colubro lacertino, il più grande serpente europeo, la lucertola ocellata, e tra gli uccelli il passero,l'occhiotto, la strepazzolina, il picchio rosso maggiore, il cuculo, il codirosso, e in presenza massiccia si può individuare il merlo, il fringuello e il pettirosso. Folta anche la presenza di rapaci. Nell'entroterra vi è la presenza del gallo forcello e dei camosci. Invece sugli Appennini sono presenti i lupi appenninici, i cinghiali e i cervi.	5708	Liguria	67	773
In Liguria sono presenti anche 9 parchi regionali, un parco nazionale, 3 riserve regionali e una nazionale con cui la regione protegge il 12% del suo territorio. Vi è anche la presenza di aree marine protette situate nella costa orientale della provincia della Spezia.	5708	Liguria	67	268
Il clima della regione ligure è temperato, di tipo mediterraneo, per la mitigazione che offre il mare. Solo nell'entroterra il clima è più fresco. Oggi la Liguria è la regione italiana più ricca di foreste di latifoglie, nelle aree più interne, a differenza della costa, un tempo occupata dalla macchia mediterranea; oggi sono presenti le coltivazioni e gli insediamenti umani che hanno cancellato quasi completamente ogni traccia dell'ambiente originario che sopravvive solo in alcuni fazzoletti di terra, tra cui il Promontorio di Portofino.	5708	Liguria	67	543
Nel 1210 il principe vescovo di Trento Federico Vanga concesse solo agli zattieri la navigazione sul fiume Adige. L’Adige fu per secoli un'importante via di comunicazione che permise attività commerciali, soprattutto tra: Bolzano, Verona, Chioggia, Trento e Venezia. Il porto di Borgo Sacco si trovava in piazza Filzi.	27042	Borgo_Sacco	67	318
Il paese di Sacco ha origini remote, confermate dai ritrovamenti di resti dell’età del bronzo, di monete e di altri reperti di età romana. Già in un documento del 1241 si dice che dall'anno 800 Borgo Sacco era un luogo di deposito per le merci.	27042	Borgo_Sacco	67	244
Fino alla prima metà dell’Ottocento Sacco era un importante centro di commercio grazie alla navigazione sul fiume Adige. Alla fine dell’Ottocento si vietò agli Speditori di Sacco di commerciare sull’Adige, causando così un danno economico. Nel 1849 il comune di Sacco supplicò di costruire in paese una fabbrica per la lavorazione del tabacco, considerato che il comune di Sacco si trovava in difficoltà economiche causate dal declino dell'attività di navigazione sull'Adige. Con la costruzione della Manifattura Tabacchi si trovò una alternativa alla navigazione sul fiume Adige assumendo gli abitanti del luogo.	27042	Borgo_Sacco	67	613
Nel 1496 la cappella di Borgo Sacco venne trasformata in una vera e propria Chiesa. A partire dal 1645 fu nominato curato (cioè il capo della parrocchia) della Chiesa Guglielmo Bonfioli, che costruì altre parti della Chiesa permettendo di far entrare più persone possibili.	27042	Borgo_Sacco	67	273
In questa fabbrica i lavoratori erano solo donne, non ci fu neanche un lavoratore maschio: questo lavoro era molto impegnativo e serviva molta precisione: per questo erano assunte solo le donne (chiamate zigherane), perché loro avevano delle mani fini e magre, cosa che offriva loro la precisione nel lavorare il tabacco.	27042	Borgo_Sacco	67	321
Nel 13 maggio 2012 fu inaugurata la Statua della Zigherana, realizzata in bronzo e alta poco più di 1 metro, come riconoscimento e ringraziamento per tutte le donne roveretane, che impiegarono il loro tempo e tantissima fatica per lavorare il tabacco. Questa statua fu scolpita dall'artista solandro (dalla val di Sole) Livio Conta. L’artista si ispirò ad una zigherana seduta a lavorare il tabacco: la osservò per tanto tempo, finché non trovò il modo perfetto per realizzarla.	27042	Borgo_Sacco	67	478
Se adesso andiamo alla manifattura, noteremo che è cambiata tantissimo: il luogo è stato rinnovato. Ci sono varie sezioni e uffici divisi in reparti specifici che si occupano di molteplici lavori. Questo spazio di lavoro è molto green, ed offre anche la possibilità di visitarlo.	27042	Borgo_Sacco	67	279
Tempo fa c’erano degli uomini che vollero rifare il lavoro dei loro antenati ovvero percorrere l’Adige, nelle sue vie, con tronchi attaccati fino a formare una zattera. Dopo essere stati utilizzati venivano venduti come “legno da opera”, ovvero legno utilizzato per le costruzioni.	27042	Borgo_Sacco	67	281
Dopo tanti commerci di questo tipo fu creata una cerimonia che avviene ogni anno chiamata proprio La Zatterata. Questa gara divenne una tradizione e si celebra con dolci, pasta e concerti in piazza, come molte altre feste. Ora fa parte della grande manifestazione di “Un borgo e il suo fiume”.	27042	Borgo_Sacco	67	293
La Zatterata viene fatta nel mese di Giugno, di solito nella prima settimana. Prima era solo una piccola festa ma grazie a Lucio Dama (guida del comitato) la Zatterata divenne una vera e propria manifestazione. Le imbarcazioni assemblate scendono in acqua da Calliano fino a Borgo Sacco (Rovereto). L’equipaggio è formato da 6 zattieri e una donzella e uno di questi sette sarà il Capo Zattera.	27042	Borgo_Sacco	67	394
Durante il tragitto le 10 squadre dovranno superare 9 prove di abilità, prima di arrivare alla fine. La squadra che avrà svolto il percorso nel minor tempo possibile e con meno penalità sarà il vincitore del premio. Il premio in palio è uno stendardo che riproduce l’antico stemma di Borgo Sacco.	27042	Borgo_Sacco	67	296
La famiglia Bossi Fedrigotti aveva origini della Lombardia e iniziò a vivere a Sacco nella metà del quindicesimo secolo. Il primo antenato fu Nicolao del Buoso, morto nel 1434. Nel 1717 i fratelli Giovanni e Fedrigo divennero poi parte della nobiltà del Sacro Romano Impero con il titolo nobiliare “von Ochsenfeld”.	27042	Borgo_Sacco	67	315
I Bossi Fedrigotti hanno avuto molto a che fare con Borgo Sacco, Rovereto e la Vallagarina. Prima i Bossi Fedrigotti arrivarono e iniziarono a lavorare per la Compagnia di Spedizione, che gestiva il traffico delle zattere sull’Adige. Dopo, grazie alla fiera di Bolzano, la famiglia accumulò un grande proprietà terriera, che diventò più grande grazie a Pietro Modesto.	27042	Borgo_Sacco	67	368
Nella seconda metà del Settecento, i Bossi Fedrigotti iniziarono a prendersi cura dell'allevamento del baco da seta e si dedicarono alla viticoltura. Filippo, oltre che socio e presidente dell'Accademia Roveretana degli Agiati, iniziò anche lui a praticare questa attività con passione. Fu ideatore e sostenitore della Società Agraria roveretana e fondatore della Scuola Agraria di Rovereto. Avendo tante idee, suggerì di usare le forbici al posto del falcetto tradizionale per tagliare le viti.	27042	Borgo_Sacco	67	495
Il palazzo dei Bossi Fedrigotti fu progettato e costruito nel 1700 a Rovereto. Avendo vissuto tanto tempo a Rovereto e avendo un ruolo economico-politico molto importante per la città, il muratore Carlo Caminada fu il costruttore del Palazzo. Non si sa ancora se il palazzo fu commissionato da Ambrogio Rosmini oppure se si propose il nobile Fedrigotti. Questo fu il Palazzo dove vissero i Fedrigotti, però la loro casa, in cui sono stati cresciuti, è a Sacco. Ora è stata messa all’asta e venduta per tre milioni di euro. Il palazzo però non fu solo della famiglia Fedrigotti, ma nel 1920 fu ceduto all'Istituito delle Dame Inglesi in cui fu trasformato in una scuola-convitto per le ragazze. Nel 2005 inoltre è diventato parte dell'Università degli Studi di Trento.	27042	Borgo_Sacco	67	767
La sua opera più importante è stata “La Storia della Valle Lagarina” suddivisa in due volumi, il primo parte dalla dominazione etrusca e arriva alla dominazione dei veneziani, e il secondo volume parte dalla dominazione degli austriaci fino al suo tempo.	27042	Borgo_Sacco	67	254
"La storia racconta di una rapina molto ambiziosa e originale: irrompere nella Zecca di Spagna a Madrid, far stampare migliaia di milioni di banconote e scappare con il denaro senza essere arrestati. L'ideatore di questa impresa è un uomo conosciuto come ""Il professore"". Il reclutamento di ogni componente della squadra non è casuale: Il professore, infatti, seleziona attentamente un gruppo di persone con dei precedenti penali. Ogni componente durante la rapina agisce con una tuta rossa e una maschera del pittore spagnolo Salvador Dalí. Considerato il divieto di rivelare la propria identità durante la rapina, viene assegnato ad ogni rapinatore un nome di città: I rapinatori scelgono il soprannome Tokyo, Rio, Berlino, Nairobi, Helsinki, Mosca, Denver e Oslo."	23781	La_casa_di_carta	67	765
Non solo le identità devono restare oscurate, ma viene proibito anche di avere rapporti sentimentali tra i rapinatori. I nove protagonisti preparano il colpo per cinque mesi in una casa abbandonata a Toledo. La giovane donna soprannominata Tokyo è la voce narrante che la racconta tutto quello successo durante la rapina. Durante lo svolgimento della rapina sorgono divergenze tra i rapinatori e corre il rischio di mandare a rotoli il piano. La banda riesce a entrare nella Zecca di Spagna fingendosi militari della Guardia Civil che scortano un tir pieno di bobine di carta per banconote.	23781	La_casa_di_carta	67	590
La polizia invia sul posto l'ispettore Raquel Murillo, una donna molto determinata, mamma di una bambina e con una difficile situazione sentimentale. Tutto sembra procedere come pianificato dal professore, ma a un certo punto, la storia prende degli sviluppi inattesi, che sembrano cambiare le vite di tutti i protagonisti, l'ispettore Murillo compresa. Alla fine il colpo riesce e la banda fugge in isole paradisiache in gruppi di due, girando il mondo per due anni.	23781	La_casa_di_carta	67	467
La seconda stagione è ambientata circa 3 anni dopo gli eventi della prima, i rapinatori, per liberare Rio, uno dei componenti della banda che è stato catturato dalla polizia, irrompono all’interno della Banca di Spagna per rubare l’oro, fingendo di essere un plotone dell’esercito spagnolo.	23781	La_casa_di_carta	67	290
"La storia di Torino comincia nel II secolo avanti Cristo quando sulle rive del fiume Po s'installano le prime tribù celtiche che ricercavano delle pianure coltivabili. Queste tribù erano chiamate Taurisci: è da qui viene il termine ""Torino"" e il soprannome ""la città dei tauri""."	405	Torino	67	278
Diviene città romana nel 28 a.C. sotto il nome di Augusta Taurinorum. In questa epoca, era un centro militare circondato da mura a pianta quadrata. Dopo la caduta dell'Impero Romano, passò sotto il controllo degli Ostrogoti, dei Longobardi e dei Franchi. Questo è uno dei periodi più bui della storia della città.	405	Torino	67	313
Nel XIX secolo, Torino è il centro del Risorgimento italiano con Vittorio Emanuele II di Savoia, re della dinastia dei Savoia, Camillo Benso, conte di Cavour e Giuseppe Garibaldi, uomini che riuscirono ad unificare l'Italia. Così, nel 1861, Torino diviene dapprima capitale del Regno di Sardegna e poi prima capitale del Regno d'Italia (stato che conserverà fino al 1865).	405	Torino	67	372
La Società Sportiva Lazio è una società polisportiva italiana con sede a Roma, nota soprattutto per la squadra calcistica che milita in Serie A e che ha vinto 2 scudetti, 7 Coppe Italia, 5 Supercoppe Italiane, una Coppa delle Coppe UEFA ed una Supercoppa Europea.	5242	Società_Sportiva_Lazio	68	263
Alcuni tra i più famosi giocatori che hanno militato nella Lazio sono: Silvio Piola, miglior marcatore in assoluto della Serie A con 274 gol, Giorgio Chinaglia, Bruno Giordano e, recentemente, Alessandro Nesta, Tommaso Rocchi e Miroslav Klose.	5242	Società_Sportiva_Lazio	68	243
"L'ultimo episodio è stato nel 2009 quando nella partita Lazio-Inter 0-2 i supporters biancocelesti hanno appeso uno striscione con su scritto ""Oh, no"" ironicamente agli odiati rivali della Roma visto che con una vittoria dell'Inter i giallorossi avrebbero perso altri punti per la lotta allo Scudetto."	5242	Società_Sportiva_Lazio	68	301
Il gas è uno dei quattro stati della materia oltre allo stato solido, allo stato liquido e al plasma. I gas non hanno una propria forma ma tendono a occupare tutto lo spazio a loro disposizione, perché le loro particelle si muovono liberamente in tutte le direzioni.Le particelle sono delle parti piccolissime di ogni stato: solido liquido e gassoso.Quindi i gas e gli aeriformi cioè l'aria ecc... Occupano tutto lo spazio disponibile, poi i gas sono comprimibili. Un gas non si può toccare però può essere nocivo, non tutti gas però lo sono come elio, non è nocivo ma se lo si assorbe da una voce stridula.	15730	Gas	68	607
Lo sfondo dello stemma è di colore azzurro. Vi è rappresentato un castello costituito da una sola torre con bordi merlati e delle finestre. Sulla sommità della torre è appoggiata una poiana selvatica , con il becco pieno, pronta a spiccare il volo.	34288	Pojana_Maggiore	69	248
Situato nella parte più meridionale della provincia di Vicenza , al confine con la provincia di Verona e la provincia di Padova, il territorio di Pojana Maggiore si presenta completamente pianeggiante con piccoli corsi d’acqua a carattere locale, come il Ronego e l' Alonte , che segna per un tratto il confine settentrionale e orientale del comune, e il Guà.	34288	Pojana_Maggiore	69	359
In epoca storica la zona era attraversata dall’antico letto del fiume Adige, il cui corso si è poi spostato a sud, in seguito agli sconvolgimenti idrogeologici del periodo alto-medioevale. L’antico passaggio dell’Adige e gli eventi ad esso collegati sono ancora oggi testimoniati dai toponimi di alcune località del comune , come Sabbioni , Conche e Rotte.	34288	Pojana_Maggiore	69	356
I molti reperti ritrovati nel territorio di Pojana ci permettono di ipotizzare che esso era già abitato durante l’epoca preistorica. Le più antiche testimonianze dei romani risalgono alla fine del II secolo a.C. : la zona di Este e le terre circostanti furono date come premio ai soldati che avevano combattuto nella battaglia di Azio. Il terreno venne bonificato e furono costruite diverse strade.	34288	Pojana_Maggiore	69	398
Verso la metà del XIV secolo il territorio fu sottoposto, sotto l’aspetto amministrativo e fiscale, al vicariato civile di Orgiano e rimase tale fino alla fine del XVIII secolo. Nel 1404, dopo esser stato conteso tra le città di Vicenza, Venezia e Padova, entrò a far parte della Repubblica di Venezia.	34288	Pojana_Maggiore	69	302
Con la caduta della Repubblica di Venezia il territorio poianese finì sotto il dominio francese e austriaco. Nel 1814 entrò a far parte del Lombardo- Veneto, mentre solo nel 1866, al termine della Terza guerra d’Indipendenza entrò a far parte del Regno d’Italia.	34288	Pojana_Maggiore	69	262
Nel 1911 Pojana fu collegata a Venezia mediante la linea ferroviaria Vicenza - Montagnana. Con lo scoppio della Prima guerra mondiale molti giovani poianesi vennero chiamati al fronte. Furono le donne ad occuparsi della famiglia, dei campi, dei raccolti e delle stalle. Quando la guerra terminò molti soldati non fecero più ritorno : il loro nomi sono incisi sulla pietra del Monumento ai caduti che li ricorda, situato in Via Matteotti.	34288	Pojana_Maggiore	69	437
Durante la Resistenza , la lotta portata avanti dai partigiani contro l’occupazione nazifascista del territorio italiano, la mattina del 15 ottobre del 1944 furono fucilati dai nazifascisti sei partigiani appartenenti alla brigata ‘’Pierobon ‘’ , originari della vicina Noventa Vicentina, e il poianese Antonio Pastorello, colpevole di aver dato ospitalità ai partigiani che operavano nella zona.	34288	Pojana_Maggiore	69	396
A Pojana si contano circa 23 capitelli di cui ben 16 sono dedicati alla Madonna. Durante il mese di maggio ci si riuniva davanti ai capitelli tutte le sere per il rosario. Alla fine del mese in ogni contrada si celebrava la santa messa: gli agricoltori della via portavano un mazzo di croci intagliate nel legno per farle benedire; le croci benedette venivano poi messe nei campi, negli orti e nelle stalle per invocare la benedizione della Madonna sui raccolti, sugli animali e sulle famiglie. Al termine della celebrazione si faceva una festa con un buffet per tutti i partecipanti.	34288	Pojana_Maggiore	69	584
Gli anziani del paese ricordano che nei mesi estivi si faceva una processione per invocare la pioggia: si partiva dalla chiesa con la statua della Madonna e si arrivava davanti al capitello di Via Borgo Brusà, dove allora c'era una statua in legno della vergine.	34288	Pojana_Maggiore	69	262
Ogni anno il 13 giugno si celebrava la Santa Messa davanti al capitello di Sant’Antonio. Si racconta che passando di sera per via Salboro nel punto dove è stato costruito il tempietto, si potevano fare strani incontri: spiriti inquieti, animali inferociti, ombre paurose, lenzuola bianche svolazzanti, rumori e sospiri che incutevano paura… ma naturalmente si tratta solo di una leggenda!	34288	Pojana_Maggiore	69	388
Nel Paleolitico gli uomini si nutrivano con le risorse alimentari che la terra gli offriva a forza e caccia gli animali. Verso il 10.000 a.C., qualche gruppo di umani incominciavano ad organizzarsi per produrre il cibo che trovavano o cacciavano in abbondanza, nacque così l'agricoltura. Le prime piante ad essere coltivate furono nelle terre ricche d'acqua dei bacini fluviali come il Nilo e tra il fiume Tigri ed Eufrate. Le terre che venivano inondate regolarmente dalle colmo dei grandi fiume lasciando i terreni puliti, livellati, morbidi e fertilizzati dal limo, pronti a essere semplicemente seminati, in cui germogliavano cereale di vario tipo.	9303	Agricoltura	71	652
"A lei si sono dedicati dei riconoscimenti. In Italia la prima nave rompighiaccio è stata chiamata con il nome di ""Laura Bassi""( Nel gennaio 2023 la nave ""Laura Bassi"" ha raggiunto il punto più a sud dell'Antartide finora mai toccato dall'uomo). (*)"	31900	Laura_Bassi	73	248
Il 12 maggio 1732, su decisione del Senato Accademico e grazie all’interessamento del cardinale Prospero Lambertini, l'Università di Bologna le conferì la laurea in filosofia. Le assegnò, per la stessa materia, una libera docenza, e nello stesso anno la introdusse nel collegio dei dottori di filosofia.	31900	Laura_Bassi	73	303
L'Argentina è uno stato dell'America meridionale. Confina a nord con la Bolivia e il Paraguay, a nordest con Brasile e Uruguay, a est con l'Oceano Atlantico, a ovest con il Cile e a sud sempre con il Cile e le acque atlantiche del Passaggio di Drake. Il tango è una danza tradizionale di Argentina. E arrostire la cucina tipica dell'Argentina.	5579	Argentina	74	343
Le esplorazioni organizzate dalla Spagna nel secolo XVI portarono ad Americo Vespucio, nel 1502, ed a Juan Díaz di Solís nel 1516, ad addentrarsi nell'estuario che battezzarono Rio de la Plata, in onore al metallo che cercavano e non trovarono. Nel 1526, Sebastián Gaboto fondò un forte sulle rive del fiume Carcarañá, primo stabilimento in Argentina.	5579	Argentina	74	351
Per frenare l'avanzamento portoghese, la Spagna inviò alla regione Pedro de Mendoza, previo contratto che stabiliva privilegi politici ed economici al conquistatore. Nel 1536, de Mendoza fondò Santa María del Buen Aire, piccolo villaggio, che nel 1541 fu abbandonato non potendo resistere l'assedio indigena.	5579	Argentina	74	308
L'Argentina fu dipendenza del Perù fino il 1776. Costituitasi dal 1617 come provincia autonoma di Buenos Aires divenne nel 1776 viceregno del Rio de la Plata, insieme a Bolivia, Uruguay e Paraguay. Una forte borghesia commerciale abitante di Buenos Aires, favorevole al libero commercio, fu la generatrice del movimento rivoluzionario del 1810 che creò le Province Unite del Rio de la Plata e destituì il viceré accusandolo di mancanza di fedeltà alla penisola, occupata dalle truppe napoleoniche.	5579	Argentina	74	497
Le Province Unite del Rio de la Plata non optarono per l'indipendenza fino al 1816 quando il restaurato monarca spagnolo Fernando VII ed i suoi fedelissimi evidenziarono essere incompatibili col liberalismo istituzionale e commerciale al quale aspirava la Giunta di Governo di Buenos Aires. Dal 1819 al 1829 scoppiò una guerra civile tra le province federalisti e i liberali e unitari di Buenos Aires.	5579	Argentina	74	401
