text	page_id	page_title	page_revisions	chars
Il matematico arabo Alhazen, intorno all'anno 1000 scrisse il primo grande trattato di ottica, in cui descrive come nell'occhio umano il cristallino formi un'immagine sulla retina. L'utilizzo comune delle lenti è probabilmente cominciato nel 1280 con l'invenzione degli occhiali.	21508	Lente	50	279
La cellula, in biologia, è la più piccola unità classificabile come esseri viventi: nasce, si nutre, si riproduce e muore. Certi organismi viventi sono unicellulari, il che significa che sono composti da una sola cellula: è il caso dei lieviti o dei batteri. Altri organismi sono composti da vari miliardi di cellule, come l'essere umano, sono detti pluricellulari.	5496	Cellula	50	365
Tipicamente la cellula è formata da un nucleo, nel quale sono, tra l'altro contenuti, i cromosomi, e da un circostante citoplasma, delimitato dalla membrana plasmatica, nel quale sono immersi vari tipi di organuli specializzati ai quali sono devolute fondamentali funzioni metaboliche.	5496	Cellula	50	285
Esistono differenti tipi di cellule. Una cellula umana, per esempio, è differente da quella di un batterio perché contiene differenti compartimenti: gli organelli o organuli. Ha un nucleo cellulare, dei mitocondri, e se la cellula è vegetale, dei cloropasti. I batteri non contengono alcun organello: essi hanno un solo compartimento.	5496	Cellula	50	334
La cellula è stata scoperta nel 1665 da Robert Hooke, biologo inglese vissuto tra il 1635 e il 1703. Usò per primo il nome cellula che deriva dal latino cella che significa cameretta per indicare le piccole cavità delle pareti, che aveva scoperto analizzando un pezzo di sughero al microscopio.	5496	Cellula	50	294
Nel 1839 Mathias Jacob Schleider, botanico e filosofo tedesco, insieme a Theodor Schwann, biologo tedesco dichiarano che la cellula è “l’unità fondamentale di ogni essere vivente”, perché hanno dedotto che, analizzando vari organismi, che tutti sono formati da cellule.	5496	Cellula	50	269
Le cellule vengono analizzate e osservate al microscopio, che può essere ottico o elettronico. Infatti questo è uno strumento usato da tutti gli scienziati per analizzare campioni microscopici, cioè che non si possono osservare a occhio nudo.	5496	Cellula	50	242
"Cellule procariote: sono delimitate dalla membrana plasmatica che è rivestita all'esterno dalla parete cellulare. Non hanno un vero e proprio nucleo (proprio per il nome che in greco corrisponde a prokaryota: pro- ""prima"" e karyon ""nucleo"", quindi nucleo primitivo) proprio perché il DNA è libero nel citoplasma, senza membrana nucleare; il materiale nucleare forma una massa che sembra un gomitolo detto nucleoide. I procarioti sono stati i primi organismi a comparire sulla Terra (Monere) e ancora oggi rappresentano la maggior parte dei viventi."	5496	Cellula	50	548
Cellule eucariote: hanno il materiale genetico dentro al nucleo racchiuso dalla membrana nucleare; esternamente sono delimitate dalla membrana plasmatica. L’organizzazione è complessa e gli organismi sono più evoluti; le cellule eucariote sono presenti negli organismi di 4 Regni: animali, vegetali, protisti e funghi.	5496	Cellula	50	318
Il nucleo cellulare, controlla tutta la cellula, è il “cervello” di ogni cellula in grado di controllare e dirigere tutte le funzioni che avvengono in essa. Al suo interno è presente la cromatina, formata da DNA, un codice cifrato che contiene le caratteristiche genetiche della cellula. Nel nucleo c’è anche un corpuscolo più piccolo, il nucleolo	5496	Cellula	50	347
I virus sono organismi al confine tra viventi e non viventi ancora oggi la nostra classificazione è oggetto di dibattiti all'interno della comunità scientifica. Essi infatti non sono capaci di vita autonoma, per riprodursi hanno bisogno di infettare un'altra cellula.	5496	Cellula	50	267
"Autrice di rara sensibilità, nasce a Milano il 21 marzo 1931, in una famiglia della media borghesia. Viene rapita dalla grafia perfetta del padre, Nemo, che la tiene con sé quando riempie i registri da assicuratore. Alle elementari è la prima della classe e a dieci anni vince il premio ""Giovani Poetesse Italiane"" e il premio le viene consegnato dalla Regina d'Italia, Maria José. Comincia a scrivere versi all'età di quindici anni esordendo come autrice spinta da Giacinto Spagnoletti (critico letterario, romanziere e poeta) e intanto studia anche pianoforte."	13773	Alda_Merini	50	562
Già da adolescente è una ragazza malinconica e sensibile e a sedici anni si manifestano i primi segni di malattia bipolare, disturbo che la accompagnerà per tutta la vita e che la costringerà a periodi di reclusione in vari istituti d'Italia.	13773	Alda_Merini	50	242
Nel 1954 la scrittrice sposa Ettore Carniti, un uomo per nulla interessato alla poesia, cosa che creerà molte incomprensioni tra i due. La poesia è per Alda il pensiero principale, infatti, trascura tutte le altre incombenze quotidiane, comprese le quattro figlie che nasceranno dal matrimonio.	13773	Alda_Merini	50	294
"Fa ritorno a Milano, si stabilisce sul Naviglio Grande, e nel 1986 pubblica ""Fogli bianchi"" e ""Testamento"". Da quel momento in poi, Alda Merini diventa famosissima. La sua vita scorre finalmente serena, sono anni in cui compone libri come ""Delirio amoroso"" e ""Il tormento delle figure""."	13773	Alda_Merini	50	286
"Alda Merini muore il 1° novembre 2009, e le vengono dedicati i funerali di Stato il 4 novembre nel Duomo a Milano. Vicino all'ingresso della sua casa sui Navigli, dal 2010, c'è una targa che la ricorda ""Ad Alda Merini, nell'intimità dei misteri del mondo""."	13773	Alda_Merini	50	256
"In un'intervista Alda Merini ha dichiarato: ""Molti hanno pensato che la mia poesia sia la follia. Essa è una forza che nasce in me, è come una gravidanza che deve andare a termine"". La poetessa è riuscita a convertire la dolorosa esperienza dell'internamento in manicomio in straordinaria energia creativa donandoci la sua interiorità con una poesia spontanea, una voce che racconta gli stati dell'animo e tutto ciò che si agita dentro di noi in modo semplice, rendendo i suoi pensieri comprensibili a tutti e a tutte. La sua poesia è simbolo degli emarginati e dei vinti dalla vita, ma lascia spazio a una grande speranza con cui è riuscita a combattere la propria fragilità e trasformarla in forza nonostante tutte le avversità che incontrerà nella vita: ""Quelle come me guardano avanti, anche se il cuore rimane sempre qualche passo indietro"""	13773	Alda_Merini	50	845
"Il 21 marzo è la Giornata Mondiale della Poesia, e lei nasceva proprio in questo giorno, nell'equinozio di primavera del 1931, la poetessa, donna simbolo del nostro Novecento che in una celebre poesia si presenta con la sua data di nascita ""Sono nata il ventuno a primavera""."	13773	Alda_Merini	50	275
(Le Roncole, 10 ottobre 1813 - Milano , 27 gennaio 1901) è stato un compositore italiano e senatore dell'ottocento. Riconosciuto come uno dei più grandi operisti e compositori in tutto il mondo. Partecipò al movimento risorgimentale che perseguiva l'Unità d'Italia e ne divenne uno dei simboli. Conosciuto per aver composto il Va', pensiero e il Nabucco, la sua opera più nota è l'Aida.	6564	Giuseppe_Verdi	50	386
Nacque da una povera famiglia a Roncole di Busseto. Come primo maestro musicale ebbe l'organista del paese, da ragazzo si esercitava su una vecchia spinetta ed aiutava i genitori nella bottega, una modesta osteria del paese. A dodici anni aiutò il suo futuro protettore Barezzi negli affari, e frequentò il ginnasio e studiò musica (sempre a Busseto).	6564	Giuseppe_Verdi	50	351
Nel 1828, a 15 anni, compose una sinfonia ispirata a “Il Barbiere di Siviglia” di Rossini; a diciannove anni tentò di entrare in Conservatorio, ma non vi fu ammesso perché non aveva più l’età adatta e decise di proseguire privatamente gli studi con il maestro Vincenzo Lavigna, che era anche professore di solfeggio del Conservatorio.	6564	Giuseppe_Verdi	50	334
Dopo qualche anno venne nominato maestro di musica del Comune e Direttore della Banda. Nel 1835 sposò la figlia del suo protettore: Margherita Barezzi, da cui ebbe due figli e si trasferì a Milano dove, ottenuto nel 1838, un contratto con la casa di edizioni musicali Ricordi, Verdi esordì come compositore di opere.	6564	Giuseppe_Verdi	50	316
Grazie al maestro Lavigna, Verdi entra in contatto con il mondo operistico, dominato da Donizetti e Giuseppe Mercadante, e il suo nome inizia ad essere conosciuto già nel 1838, grazie alla pubblicazione di alcuni pezzi per voce e pianoforte.	6564	Giuseppe_Verdi	50	241
Nel 1838 è rappresentatata alla Scala la prima opera di Verdi, Oberto conte di San Bonifacio, che riscuote un discreto successo. Un giorno di regno, la sua seconda opera, fu composta a fatica nel periodo funestato dalla morte dei figli e della moglie che fu un insuccesso. Verdi pensa addirittura di non comporre più, ma superato il difficile momento compone e incontra il successo con Nabucco (1842) e I Lombardi alla prima crociata (1843).	6564	Giuseppe_Verdi	50	441
"In queste 2 opere, e nella successiva Battaglia di Legnano (1849), Verdi dà voce alle ispirazioni politiche dell'epoca - in particolare nei cori - e gli italiani oppressi dal dominio austriaco vi trovano espressi i loro sentimenti di indipendenza; sono storie di popoli in cui le scene corali prevalgono sulle figure dei singoli personaggi. Verdi diventa un compositore caro ai patrioti italiani e i cori tratti dalle sue opere diventano quasi un manifesto politico, perché si intonano ai sentimenti patriottici e liberali del Risorgimento. Quando nei teatri della penisola si grida ""Viva Verdi"", non si acclama solo il compositore, ma si afferma un ideale politico: ""Viva Vittorio Emanuele Re d'Italia!"". Da questo momento Verdi intraprende un'attività frenetica (egli stesso definisce questo periodo «anni da galera») per soddisfare le richieste dei teatri e mette in scena drammi e tragedie di argomento tipicamente romantico (tradimenti, ingiustizie, amori, passioni): I due Foscari (1844, da un dramma di Byron), Ernani (1844, da Hugo), Macbeth (1847, da Shakespeare) e molti altri. Verdi segue personalmente le messe in scena delle sue opere e quindi viaggiò moltissimo."	6564	Giuseppe_Verdi	50	1176
"Alla seconda fase appartengono tre grandi capolavori, la celebre trilogia ""popolare"", composta da Rigoletto, Il trovatore, La traviata. Dalla storia dei popoli si passa alla storia degli individui: Verdi racconta la loro vita sentimentale e i conflitti sociali in cui sono coinvolti con una musica che scolpisce personaggi a tutto tondo e scava in profondità la psicologia dei protagonisti. Dalle questioni politiche si passa ai problemi sociali di quell'epoca."	6564	Giuseppe_Verdi	50	461
In queste opere Verdi modifica la struttura tradizionale del melodramma per rappresentare con maggiore fedeltà il carattere dei personaggi e le situazioni. Per esempio, solitamente quando il personaggio compare per la prima volta in scena, all'inizio dell'opera, intona un'aria. Verdi non si lascia condizionare dalle abitudini e presenta Rigoletto con un recitativo, che più si presta alla descrizione del protagonista.	6564	Giuseppe_Verdi	50	420
"Il successo è ormai consolidato e Verdi può distanziare la produzione e meditarla maggiormente. Inizia anche un periodo di riflessione e di attenzione alla produzione europea. In questi anni Richard Wagner sta sottoponendo il melodramma a dei cambiamenti che Verdi non condivide. Mette quindi mano a una nuova forma d'opera in cui la fusione di azione drammatica e musica sia perfetta: occorre superare la netta distinzione tra i vari ""pezzi chiusi"", cioè le arie (momenti lirici, melodici e cantabili) e i recitativi (momenti in cui la linea musicale si avvicina molto al parlato per sostenere l'azione) per arrivare a una forma più aperta, in cui la musica possa scorrere senza interruzioni e adeguarsi liberamente alle parole e alle situazioni."	6564	Giuseppe_Verdi	50	747
Le melodie diventano perciò difficili e orecchiabili ma più ricche e varie. Verdi appare nuovo, non piace a tutti, alcuni lo ritengono, a torto, un imitatore di Wagner. Ma egli prosegue nella realizzazione di questa nuova idea di opera lirica portata avanti progressivamente da cui nascono tra gli altri Don Carlos, Aida, Otello e Falstaff.	6564	Giuseppe_Verdi	50	340
La sua prima opera Oberto Conte di San Bonifacio, richiesta dall'impresario del teatro la Scala di Milano Bartolomeo Merelli, andò in scena con successo il 17 novembre del 1839, ma la seconda opera Un giorno di regno è una commedia andata in scena il 5 settembre dell'anno dopo. Non fu apprezzata aggiungendo così sconforto a Verdi, già provato per la morte della moglie e dei due figli.	6564	Giuseppe_Verdi	50	387
"Verdi aveva 37 anni quando le sue opere erano ormai al livello internazionale rappresentati in tutti i teatri di tutta l'Europa. Aveva anche avuto l' esperienza del Grand Opéra parigino mettendo in scena I Lombardi sotto la nuova veste di ""Jerusalem“."	6564	Giuseppe_Verdi	50	251
Giuseppe Verdi dopo si allontanò dalla Scala e da Milano: si recò prima a Parigi e nel 1849 tornò a Busseto insieme a Giuseppina, divenuta ormai la sua compagna. Molte voci girarono su questo rapporto e sulla convivenza dei due, ufficializzata con il matrimonio solo nel 1859. In questi anni Verdi scrisse la cosiddetta trilogia popolare: Rigoletto, Il Trovatore e La Traviata.	6564	Giuseppe_Verdi	50	377
Il Nabucco è la terza opera lirica di Giuseppe Verdi e quella che ne decretò il successo. Nabucco fece il suo debutto con successo il 9 marzo 1842 al Teatro alla Scala di Milano alla presenza di Gaetano Donizetti. Ha aperto le stagioni operistiche del Teatro alla Scala nel 1946, 1966, 1986. È stata spesso letta come l'opera più risorgimentale di Verdi, poiché gli spettatori italiani dell'epoca potevano riconoscere la loro condizione politica in quella degli ebrei soggetti al dominio babilonese. La lettura fu incentrata soprattutto sul famosissimo coro Va pensiero, sull'ali dorate che fu intonato dal popolo ebraico.	6564	Giuseppe_Verdi	50	622
Maciej Płażyński è stato un politico polacco. Si è opposto alla dittatura in Polonia prendendo parte ai vari scioperi del suo paese e creando diverse cooperazioni e associazioni in opposizione al governo. Ha ricoperto la carica di Presidente del Parlamento e Vicepresidente del Senato in Polonia.	27657	Maciej_Płażyński	50	296
Dopo il liceo si trasferì in Slesia dove per un anno lavorò come operaio alla costruzione dell’Acciaieria di Katowice. Tornato a Danzica si laureò in legge nel 1991 presso la Facoltà di Giurisprudenza e Amministrazione dell'Università di Danzica.	27657	Maciej_Płażyński	50	246
Nel 1983 fondò la Cooperativa di Servizi in altezza ”Swietlik”, che dà lavoro e rifugio ai leader dell’opposizione di Danzica. Nel 1987 divenne Presidente del Club del Pensiero Politico Lech Badkowski, che aderisce l’area liberale dell’opposizione di Danzica. Nel 1989 fondò, insieme ad alcuni suoi amici, un'associazione economica del Partito dei Liberali, la Kongres Liberałów. Nel 1987 divenne presidente di un club conservatore.	27657	Maciej_Płażyński	50	432
Come voivoda di Danzica, nel marzo 1992, contribuì a fondare la prima società sportiva della città: Lechia Gdańsk. Inoltre, nel 1996, ha aiutato a trovare sponsor e sostegno per la squadra di calcio di Danzica in decadenza Lechia/Olimpia Gdańsk, che tuttavia fu sciolta più tardi.	27657	Maciej_Płażyński	50	280
Il licenziamento di Płażyński provocò una serie di proteste da parte dei rappresentanti dei governi locali, dei lavoratori e di altri gruppi professionali, che culminarono in una manifestazione di diverse migliaia di persone presso il Tribunale Artus di Danzica. Nello stesso anno divenne vicepresidente dell'Azione elettorale di solidarietà nella provincia di Danzica.	27657	Maciej_Płażyński	50	369
Il 19 gennaio 2001, insieme a altri politici e suoi amici, fondò il partito Piattaforma Civile (PO) di cui divenne il primo Presidente. Nello stesso anno venne nuovamente eletto deputato. Nel 2003 uscì da PO per differenze su come portarlo avanti.	27657	Maciej_Płażyński	50	247
Morì il 10 aprile 2010 nello schianto dell'aereo polacco Tu-154M a Smolensk. Fu sepolto il 21 aprile dello stesso anno nella Cappella di Nostra Signora della Porta dell'Aurora, nella Basilica di Santa Maria a Danzica, diventando la seconda persona ad essere vi fu sepolto nel dopoguerra.	27657	Maciej_Płażyński	50	287
L'Astronomo o Astrofisico è un ricercatore che indaga e interpreta i fenomeni fisici che riguardano l'universo. Con osservazioni da Terra e dallo Spazio, l'Astrofisico studia la natura di pianeti, stelle, galassie e di tutti i sistemi e le strutture dell'universo.	23133	Scienziato	50	264
Anche l'automobile che guidiamo noi oggi l'ha progettata Leonardo ma non costruita, infatti la prima automobile a tutti gli effetti è stata creata molto tempo dopo… inoltre l’“automobile” di da Vinci però, a differenza di quelle di oggi, era una specie di trabiccolo a molla, un oggetto teatrale utilizzato per stupire gli spettatori.	23133	Scienziato	50	334
Galileo Galilei è stato un fisico, astronomo, filosofo, matematico e accademico italiano, considerato il padre della scienza moderna. Personaggio chiave della rivoluzione scientifica, per aver esplicitamente introdotto il metodo scientifico (anche metodo sperimentale), il suo nome è associato a importanti contributi in fisica e in astronomia.	23133	Scienziato	50	344
La Strada Parco dal 1929 al 1988 è stata una linea ferroviaria che, fino al 1963, ha collegato il comune di Penne a Pescara. L’idea di raccordare Pescara e Montesilvano tramite una filovia, ovvero un filobus, è nata per smaltire il traffico cittadino. Attualmente termina in prossimità dell’area di risulta, adiacente alla Stazione di Pescara Centrale. Dell’ex tracciato ferroviario è rimasto solo un casello. Il nome originale della via della Strada Parco è Via Castellamare Adriatico.	31825	Strada_Parco	50	486
A partire dal 1908 la provincia di Teramo ha lavorato al progetto del tracciato ferroviario fino alla prima guerra mondiale, che ne causò l’improvvisa interruzione. L’opera fu conclusa nel 1929, dal regime fascista. Nel 1929, il 22 settembre, fu inaugurata la tratta ferroviaria che collegava la città di Pescara a Penne, gestita dalla F.E.A. ( Ferrovie Elettriche Abruzzesi). Nel 1943, con la seconda guerra mondiale, furono bombardati i binari e il treno, prima dell’ingresso della galleria “Collatuccio” a Loreto Aprutino. Nel 1955 il tratto ferroviario fu ripristinato. Nel 1963 la motorizzazione di massa dei cittadini, avvenuta negli anni ’60, segnò la fine del treno Pescara-Penne. Fu lasciato in attività il tracciato ferroviario per la percorrenza di altri treni. Nel 1988, il 31 Gennaio, passò l’ultimo treno e la tratta fu chiusa.	31825	Strada_Parco	50	841
La TUA, Trasporto Unico Abruzzese, azienda di trasporto pubblico locale, ha presentato i nuovi 6 filoveicoli che saranno lunghi 18 metri e avranno una capienza massima di 137 passeggeri. I filobus transiteranno lungo il percorso dell’ex tracciato ferroviario che collegherà Pescara a Montesilvano. Il tragitto filoviario è di 8 km e 150 metri e per percorrerlo ci vorranno circa 20 o 25 minuti, dimezzando così i tempi che attualmente occorrono per attraversare i due centri abitati. I sei mezzi filoviari sono costati circa 6 milioni di euro, questa infrastruttura della città di Pescara avrà l’obiettivo sostenibile di consentire ai cittadini di sostituire il mezzo privato con quello pubblico.	31825	Strada_Parco	50	696
Il vero nome della Strada Parco è via Castellammare Adriatico, il soprannome è stato dato dai pescaresi che considerano questo percorso una zona di ritrovo, verde, ciclabile e pedonale. Dell’ex tracciato è rimasto un casello ferroviario, il 348 582 che si trova all’angolo di Via Toti. Nell’estate 2022, i cittadini hanno usato una parete di questo casello come “muro della gentilezza”, in cui sono stati lasciati vestiti messi a disposizione di chiunque ne avesse bisogno. Lungo il tratto finale del percorso, si segnala la presenza della vecchia scuola media Leopoldo Muzii, prima utilizzata dal Conservatorio di Pescara, oggi in stato di abbandono. Sulla Strada Parco, il mercoledì dalle 7:00 alle 14:00, c’è il mercato in cui si possono fare acquisti di vario tipo, dall’abbigliamento ai prodotti alimentari locali.	31825	Strada_Parco	50	819
Il diametro è quel segmento che ha per estremi due punti qualsiasi sulla circonferenza e per punto medio il centro della circonferenza; per queste caratteristiche è detto corda massima. Il diametro è esattamente il doppio del raggio e, conoscendo la misura di quest'ultimo, per calcolare il diametro basta moltiplicare per due la misura del raggio secondo la seguente formula: d=r^2 dove d=diametro e r=raggio. Conoscendo invece la misura della circonferenza, per calcolare la misura del diametro si divide la circonferenza per la misura del Pi greco seguendo la seguente formula: d=C/π dove d=diametro, C=circonferenza e π=Pi greco (3,14 circa).	18271	Circonferenza	50	646
La corda del cerchio è un segmento che congiunge due punti di una circonferenza senza passare dal centro. Le corde del cerchio sono infinite perché ci sono infiniti punti in una circonferenza. La retta che giace sopra la corda si chiama “secante”.	18271	Circonferenza	50	247
Un arco è un pezzetto di circonferenza delimitato da due punti qualsiasi sulla circonferenza detti estremi che sottende un determinato angolo al centro. Lo spazio compreso fra un arco e una corda è detto segmento circolare a una base. Per calcolare la lunghezza di un arco bisogna impostare una proporzione come C : 360° = l : α dove C=misura della circonferenza, l=lunghezza dell’arco e α=ampiezza dell’angolo che l’arco sottende.	18271	Circonferenza	50	431
Con il termine materia, si intende qualsiasi cosa che abbia massa e che occupi spazio. La parola materia deriva dal latino mater che significa madre. Infatti la materia può essere considerata la madre di tutte le cose come le roccia, l'acqua, l'aria, le nubi sono fatti di materia.	16407	Materia_(fisica)	51	281
"Le sostanze sono composte da piccole particelle dette atomi. Il filosofo greco Democrito gli scopri già 2400 anni fa e li chiamò così perché la parola ""atomi"" in greco vuole dire ""indivisibili"". In natura ci sono 92 tipi di atomi e hanno tutti un nome e un simbolo per esempio: Ferro(Fe), Oro(Au), Idrogeno(H). In certi casi i simboli sono composti da più di una lettera perciò la prima va scritta sempre maiuscola e la seconda va scritta minuscola, invece se il simbolo è composto da una sola lettera va scritta maiuscola. Questi atomi quando viaggiano a due a due vengono chiamati molecole. Esempi di molecole: ferro (Fe), idrogeno (H), ossigeno (O)."	16407	Materia_(fisica)	51	652
Diverse sostanze mescolate insieme si chiamano composte. In certi casi si può distinguere ad occhio nudo le varie sostanze che compongono un miscuglio in questi casi il miscuglio è chiamato miscuglio eterogeneo: per esempio il granito (distinguo il colore bianco dal nero). Invece le sostanze in cui non è possibile distinguere ad occhio nudo un componente dall'altro, in questo caso il miscuglio è chiamato miscuglio omogeneo: per esempio il te (non distingui l'acqua dal rosso del tè).	16407	Materia_(fisica)	51	487
Per sommare frazioni che hanno denominatori uguali, bisogna tenere uguale il denominatore e sommare i numeratori. Per sommare frazioni che hanno denominatori diversi, bisogna prima portare le frazioni allo stesso denominatore, trovando il m.c.m. dei denominatori. Una volta trovato il denominatore comune bisogna dividere quest'ultimo per il denominatore di ogni frazione e il risultato moltiplicarlo per il suo numeratore, trasformandole in frazioni equivalenti.	13991	Addizione	51	463
Nel 395 l'impero romano fu diviso in due parti: l'impero romano d'oriente e l'impero romano d'Occidente. Quest'ultimo fu conquistato dalle popolazioni barbariche nel 476, ma la parte orientale sopravvisse per quasi mille con il nome di impero bizantino.	16522	Impero_bizantino	51	253
Esso raggiunse il massimo splendore con Giustiniano I, che fu Basileus (cioè imperatore d'oriente) dal 527 al 565. Egli intraprese con successo alcune campagne militari per conquistare l'Africa settentrionale e la penisola italiana. Qui, in particolare scoppio la guerra gotica, che vide contrapporsi i Goti e i bizantini di Giustiniano. Il conflitto fu vinto da quest'ultimi, che crearono un esarcato con capitale Ravenna. In questo modo l'impero bizantino raggiunse la sua massima espansione poiché si estendeva dalla Spagna al Medio oriente.	16522	Impero_bizantino	51	544
Tra il 976 e il 1025 il Basileus Basilio II promosse una nuova età aurea in cui i Bizantini godettero di maggiori ricchezze, produssero grandi opere d'arte e di letteratura, oltre a rafforzare l'esercito. In particolare Basilio II combatté contro i bulgari, e durante il suo regno, tra il 1001 e il 1018 conquista la penisola balcanica. Alla sua morte (1025) l'impero bizantino è al culmine della potenza. Inoltre tra il 1038 e il 1043 i bizantini riconquistano la Sicilia orientale e sempre nel 1043 i russi cercarono di attaccare Costantinopoli, ma vengono sconfitti dal Basileus Costantino IX.	16522	Impero_bizantino	51	596
