text	page_id	page_title	page_revisions	chars
In Sardegna vi è la macchia mediterranea, costituita da alberi e arbusti. Secondo il tipo di clima si possono trovare vari tipi di vegetazione: ginepro, erica e corbezzolo, euforbia, ginestra, alloro, olivi, oleandro e agnocasto. La foresta di leccio è la più caratteristica, seguita dai querceti caducifogli, i castagneti e le sugherete.	346	Sardegna	54	338
La Sardegna è una regione a statuto speciale. Il capoluogo di regione è Cagliari, dopo la riorganizzazione amministrativa del 2016 la Sardegna è suddivisa in quattro province ed una città metropolitana: provincia di Nuoro, provincia di Oristano, provincia di Sassari, provincia del Sud Sardegna e città metropolitana di Cagliari.	346	Sardegna	54	329
In Sardegna vi è un sito riconosciuto come Patrimonio dell’UNESCO: il villaggio nuragico di Barumini. Circa 3.500 anni fa sulla collina di Barumini gli antichi costruirono un nuraghe e un piccolo villaggio di capanne. I nuraghi sono eccezionali monumenti che sono sono sopravvissuti fino ai giorni nostri a testimonianza di una cultura millenaria collegata alle civiltà megalitiche del bacino del Mediterraneo. La civiltà nuragica svolse un ruolo importante nella diffusione della cultura micenea ed in seguito di quella fenicia, anche se alcune rimangono avvolte dal mistero.	346	Sardegna	54	576
Nella produzione artigianale di qualità, il cioccolato è preparato utilizzando la pasta di cacao come realizzata e imballata nei paesi origine con l'aggiunta di ingredienti e aromi. In alcuni casi il produttore parte direttamente dalle fave di cacao procedendo alla tostatura e alle successive fasi della lavorazione.	21388	Cioccolato	54	317
I liquidi hanno libertà di movimento dato che gli atomi]] sono legati soltanto da piccoli e fini legami questo accade perché le particelle di un liquido possono muoversi e scorrere una sull'altra, diverso invece per la materia allo stato solido. I liquidi come l'acqua hanno un volume (prendono la forma del contenitore), sono incomprimibili cioè non possono essere forzati a occupare un volume minore di quello che possiedono. I liquidi sono anche molto elastici sotto l'azione di una forza, ma riprendono immediatamente la forma del contenitore in cui sono stati versati (*) .	15733	Liquido	54	578
La Costa d'Avorio è una repubblica semi-presidenziale, cioè il Presidente ivoriano è Capo dello Stato ma controlla il Capo del Governo. Ha il parlamento monocamerale, l'Assemblea Nazionale, che ha 255 membri, che vengono votati ed eletti ogni 5 anni.	6764	Costa_d'Avorio	55	250
La bandiera della Costa d'Avorio è composta da tre colori che sono arancione, bianco e verde. L'arancione è il simbolo della savana, che si trova a nord del Paese; il bianco della pace; il verde delle foreste che si trovano nel sud, ma anche della speranza. I colori della bandiera sono come quelli della bandiera irlandese, solo che invertiti, cioè messi al contrario.	6764	Costa_d'Avorio	55	369
L'economia della Costa d'Avorio si basa prevalentemente sulla esportazione di materie prime. Le maggiori esportazioni sono di caffè, semi di cacao e olio di palma. Ci fu un periodo che va dagli anni 1960 a 1980 che la Costa d'Avorio era tra i paesi più in crescita al mondo.	6764	Costa_d'Avorio	55	274
Il territorio dell'Emilia-Romagna è costituito per il 25% da zone montuose, per il 27% da aree collinari e per il 50% da pianura. Morfologicamente, quindi, il territorio è formato da due parti: una montuosa e collinare e l'altra pianeggiante, divise dal tracciato rettilineo della via Emilia.	5718	Emilia-Romagna	55	292
L'Appennino e solcato da diversi passi oggi facilmente superabili come: il più alto è il passo all'Albetone (1.388 m), in seguito il passo della Cisa (1.041m), il passo alla Futa (il più basso, alto solo 903m), e infine il passo alla Raticosa (968m).	5718	Emilia-Romagna	55	250
Nella zona dove ci sono gli Appenini sopra i 1350 metri di altitudine c'è il clima temperato freddo. Le estati sono fresche e gli inverni lunghi e rigidi. Nella pianura il clima è temperato, mentre nei territori ferraresi e sul delta del Po il clima temperato rende questo territorio umido e con grande quantità di nebbia e pioggia.	5718	Emilia-Romagna	55	332
Diversi studi collocano l'epoca del popolamento dell'attuale territorio cileno a circa 10.500 anni a.C. Il Cile preispanico era popolato da una varietà di culture indigene che si stanziarono in bande longitudinali, incrociando anche le Ande ed arrivando a territori attualmente argentini nell'Atlantico. Nella zona del nord del Paese i gruppi amerindi Aymara, Atacameña e Diaguita stabilirono culture fortemente agricole da parte dell'impero Inca che, dal secolo XV°, dominò una grande parte del territorio attuale del Cile, fino al fiume Maule.	157	Cile	55	545
"Nel 1520, Ferdinando Magellano fu il primo esploratore europeo a visitare il territorio cileno percorrendo lo stretto che porta il suo nome. Ma fu soltanto nel 1535 che i conquistatori spagnoli provarono a conquistare le terre della ""valle del Cile"" dopo aver sconfitto l'impero Inca. La prima spedizione, condotta da Diego de Almagro, non ebbe i risultati voluti, seguì il tentativo di conquista guidato da Pedro de Valdivia. Lungo il suo cammino verso sud, ed attraversando il deserto di Atacama, Valdivia fondò una serie di centri abitati, il primo ed il più importante, il 12 febbraio del 1541, fu la città di Santiago della Nuova Estremadura."	157	Cile	55	647
La Capitanía General de Chile, chiamata anche il Regno del Cile, fu una delle colonie più australi dell'Impero Spagnolo. A causa della sua lontana posizione dai grandi centri e dalle strade commerciali imperiali, ed a causa del conflitto con i mapuche, il Cile fu una provincia povera, appartenente al Vicereame del Perù e la cui economia era praticamente destinata per sostenere i pochi abitanti del territorio.	157	Cile	55	412
"Nel 1810, iniziò, con la costituzione della prima assemblea di governo, il processo di autodeterminazione dalla nazione, e un periodo chiamato, Patria Vecchia, che durò fino al 1814, anno della cosiddetta ""Catastrofe di Rancagua"", quando le truppe reali spagnole riconquistarono il territorio. Le truppe indipendentiste, profughe a Mendoza, formarono un battaglione con i soldati argentini l'Esercito delle Ande guidato da José de San Martín che liberò il Cile dopo la battaglia di Chacabuco, il 12 febbraio del 1817. L'anno successivo il governo del ""Direttore Supremo"" Bernardo O'Higgins Riquelme dichiarò l'indipendenza del Cile."	157	Cile	55	632
Confina a Nord con il Perù, ad Ovest è bagnata dall' Oceano Pacifico, ad Est confina con l' Argentina ed a Nord-Est con la Bolivia. Si estende su un lungo e stretto lembo di terra tra l'Oceano Pacifico e la Cordigliera delle Ande, con una superficie totale di 755.838 km², comprensiva di territori insulari nell'Oceano Pacifico delle Isole Juan Fernández, Sala y Gómez, Isole Desventuradas e l'Isola di Pasqua.	157	Cile	55	410
Il Cile è attraversato da diversi corsi d'acqua che, generalmente, discendono dalla Cordigliera delle Ande dirigendosi verso l'Oceano Pacifico. A causa della caratteristica conformazione del territorio la maggior parte dei corsi d'acqua sono piuttosto corti e con una portata scarsa. Da un punto di vista economico, pur essendo inadatti per la navigazione presentano un elevato potenziale di sfruttamento idroelettrico.	157	Cile	55	419
Nella regione del Norte Grande, ad eccezione di alcuni torrenti con regime endoreico e del fiume Loa non esistono fiumi rilevanti. Il Loa è il più lungo fiume cileno (443 km) e ha il più ampio bacino idrografico del paese, circa 34.000 km². Nella zona dell'altopiano vi sono alcuni brevi corsi d'acqua che confluiscono nel lago Chungará, situato ad un'altitudine di 4.500 m s.l.m., in quest'area si incontrano anche i fiumi Lauca e Lluta, entrambi attraversano anche la Bolivia e non superano i 100 km di lunghezza.	157	Cile	55	515
La grande lunghezza del Cile determina notevoli differenze climatiche tra le varie regioni del nord, del centro e del sud del paese. Le regioni del nord del Cile, quasi interamente desertiche, sono tra le più aride del mondo. Nelle regioni centrali invece le temperature sono di tipo mediterraneo, con estati fresche e inverni miti. Infine le regioni del sud sono caratterizzate dalla grande piovosità, dal freddo intenso e dai forti venti, in particolar modo nelle zone della Patagonia cilena.	157	Cile	55	494
Il Cile è uno dei paesi più popolosi del Sud America, con 17,1 milioni di abitanti nel 2010. Circa 5,5 milioni vivono nella capitale (Santiago del Cile). Altre città densamente popolate sono Valparaiso, Puerto Montt, Puntarenas e Vina del Mar.	157	Cile	55	243
La popolazione indigeni del Cile è inferiore a quella di molti paesi dell'America Latina (2% della popolazione), divisi in 200.000 Mapuches, 48.000 Aymaras, 21.000 Atacameños e 6.000 Quechuas. Circa i due quinti della popolazione, pari al 40%, sono meticci (mescolanza di spagnoli e amerindi), e 58% è costituito da discendenti di europei, con la Spagna, la Germania, l'Italia, Francia e Inghilterra i maggiori contributi alla società cilena.	157	Cile	55	442
La bandiera del Cile è formata da due bande orizzontali di uguali dimensioni, quella superiore è bianca e quella inferiore è rossa; sulla banda bianca, dal lato dell'asta, è presente un quadrato blu con una stella bianca a cinque punte al suo interno.	157	Cile	55	251
L'economia cilena è riconosciuta internazionalmente come una delle più solide del subcontinente latinoamericano. Tuttavia durante il corso della sua storia il Cile ha conosciuto diversi periodi di crisi (soprattutto nel regime di Augusto Pinochet) ed altri di elevata crescita ed espansione economica.	157	Cile	55	301
L'agricoltura cilena poco sviluppata è assolutamente inadeguata al fabbisogno de paese e concorre in misura molto modesta alla formazione del prodotto nazionale lordo. Solo poco più del 7% del territorio nazionale è posto a coltura e circa il 16% è a prato e a pascolo e sfruttato per l'allevamento .	157	Cile	55	300
Le industrie dei beni di consumo si sono installate nelle città (Santiago e soprattutto Valparaiso e Concepción). Importanti gli impianti di trattamento di minerali e le sue fabbriche di farina di pesce, le industrie del latte y le industrie forestali del sud (legname industriale).	157	Cile	55	282
Nonostante, l'economia cilena frenò bruscamente la sua crescita. Negli ultimi cinque anni (1997-2002) la crescita dell'economia fu di solo un 2.3%/anno contro il 5.0%/anno dei 10 anni anteriori. Tuttavia, data la situazione mondiale, paragonato il Cile con molte economie latinoamericane ed oltre, continua a distaccarsi.	157	Cile	55	321
I cileni spesso definiscono il loro paese País de Poetas (paese di poeti), la poetessa Gabriela Mistral è stata la prima donna latino americana a vincere il premio Nobel per la letteratura (1945) seguita nel 1971 dal più celebre Pablo Neruda. Altri poeti celebri sono Pedro Prado, Vicente Huidobro, Pablo de Rokha, Juvencio Valle, Rosamel del Valle, Gonzalo Rojas, Jorge Teillier, Enrique Lihn, Nicanor Parra, Carlos Pezoa Véliz e in epoca più recente Raúl Zurita, Juan Luis Martinez e Sergio Badilla Castillo.	157	Cile	55	510
Il Cile può vantare una discreta tradizione nel calcio. La nazionale cilena ha ottenuto come miglior risultato una vittoria in Coppa America nel 2015 e un terzo posto nel Mondiale del 1962, entrambi organizzati in casa. Alle Olimpiadi di Sydney 2000 il Cile ha conquistato la medaglia di bronzo nel torneo di calcio maschile. Cinque importanti calciatori che si sono distinti a livello internazionale sono Marcelo Salas, Ivan Zamorano, Arturo Vidal, Mauricio Isla e Alexis Sánchez.	157	Cile	55	481
La squadra apparve per la prima volta in campionato nel 1900 e ben presto vinse nei suoi primi anni 3 campionati italiani, oltre a trofei di minore entità quali la Medaglia del Re, la Coppa Chiasso, la Palla d'argento Dapples, ecc. Seguirono poi alcuni anni in cui pur avendo una solida società, non riuscì a prevalere su altri club in quegli anni meglio organizzati calcisticamente. Questa situazione durò dagli anni venti sino alla seconda metà degli anni quaranta.	6354	Associazione_Calcio_Milan	55	467
A partire proprio dalla fine degli anni quaranta, il Milan riuscì ad affermarsi in patria come all'estero, vincendo innumerevoli trofei attraverso numerosi campioni di nota fama, quali Gunnar Gren, Nils Liedholm, Gunnar Nordhal, Josè Altafini, Cesare Maldini, Pierino Prati, Gianni Rivera ed altri. In questi anni fino agli anni settanta uno dei più noti magistrati della storia italiana, Carlo Biotti, ex atleta e appassionato di sport, diverrà consigliere di amministrazione del Milan, sarà il momento di maggiore successo in cui il Milan diverrà noto a livello mondiale.	6354	Associazione_Calcio_Milan	55	573
Nel 1986 la società fu rilevata da Silvio Berlusconi, grazie al quale il Milan proseguì la propria tradizione vincente: con allenatori come Arrigo Sacchi, Fabio Capello, Carlo Ancelotti ed altri la squadra rossonera si aggiudicò numerosi trofei, quali scudetti, coppe europee (in più occasioni vinse la Supercoppa europea, la Coppa delle Coppe e soprattutto la Coppa dei Campioni) nonché alcune edizioni della Coppa Intercontinentale, più un Mondiale per club. Simili risultati furono ottenuti grazie a giocatori del calibro di Franco Baresi, Paolo Maldini, Mauro Tassotti, Alessandro Costacurta, Roberto Donadoni, Ruud Gullit, Dejan Savicevic, Zvonimir Boban, Demetrio Albertini, Carlo Ancelotti (sia come calciatore che come allenatore), Frank Rijkaard, Marco Van Basten, George Weah, Roberto Baggio, Filippo Inzaghi, Andrij Shevchenko, Oliver Bierhoff, Zlatan Ibrahimović.	6354	Associazione_Calcio_Milan	55	875
La regione presenta una morfologia molto variegata: monti (tra cui aree vulcaniche come i Campi Flegrei ed il Vesuvio), colli, coste, pianure, valli, fiumi, laghi, località balneari, isole ed isolotti. Il territorio è insomma molto diversificato.	5733	Campania	56	246
Oltre al Cilento, altre regioni storico-geografiche di rilievo che compongono la regione sono Terra di Lavoro (che comprende Caserta, parte della provincia di Caserta, e la parte meridionale del Lazio), il Sannio (che comprende l'intera provincia di Benevento e parte della provincia di Caserta, più luoghi di altre regioni quali Abruzzo e Molise), l'Irpinia (che include gran parte della provincia di Avellino).	5733	Campania	56	412
La Campania è bagnata dal Mar Tirreno, e presenta due grandi golfi principali, tra loro nettamente separati dalla penisola sorrentina che si colloca nel mezzo: il golfo di Napoli ed il golfo di Salerno. Abbastanza noto è anche il molto più piccolo golfo di Sorrento, menzionato nel famoso brano Caruso dal bolognese Lucio Dalla.	5733	Campania	56	328
A partire dall'VIII secolo a.C. si svilupparono lungo la costa campana diversi insediamenti di popolazioni greche, i quali insediamenti diedero in seguito origine ad alcune colonie della Magna Grecia, ad esempio: Pithecusa, Cuma, Parthenope, Neapolis, Poseidonia, Elea, Pixous. Le aree interne furono abitate dai sanniti.	5733	Campania	56	321
"Nel IV secolo a.C. parte della regione (comprendente aree casertane, napoletane e salernitane) fu, sotto i romani nominata Campania Felix, in riferimento alla ""felicità"" legata alla fertilità del territorio. Terminata l'era dei romani, la regione si ritrovò politicamente disgregata: dal V secolo d.C. parte della Campania fu sotto l'influenza longobarda, ed in misura minore un'altra parte fu sotto l'influenza dei bizantini. In quel periodo medievale crebbe di importanza la città di Salerno, che fu sede della famosa Scuola Medica Salernitana, dove i migliori medici del mondo curavano pazienti ed insegnavano l'arte medica, rappresentando un'antesignana delle moderne università."	5733	Campania	56	683
La regione ritrovò unità a partire dal X secolo, sotto la dinastia dei normanni, originando quello che a seconda del periodo fu Regno delle due Sicilie oppure Regno di Napoli. Col passare dei secoli, per la precisione dal XIII secolo al XIX secolo il territorio fu conquistato da dinastie diverse: angioini, aragonesi e borboni, e ciononostante non perse l'unità, ed anzi risultò unito a gran parte del resto dell'Italia centro-meridionale. Dopo un'iniziale parentesi palermitana, l'indiscussa capitale del regno fu Napoli, la quale malgrado le diverse dominazioni, nel corso dei secoli si affermò come uno dei principali poli culturali, artistici ed economici d'Europa.	5733	Campania	56	670
Con l'unità d'Italia avvenuta nel 1861 il ruolo culturale ed economico di Napoli a livello internazionale subì un forte ridimensionamento. Anche i restanti territori campani subirono un pesante declino, soprattutto dal punto di vista industriale.	5733	Campania	56	246
Il calcio è lo sport più seguito, anche per via delle numerose squadre campane che militano o hanno militato nel calcio professionistico, come il Napoli (vincitore di due scudetti, una Coppa UEFA ed altri trofei ufficiali), la Salernitana, l'Avellino, il Savoia, la Juve Stabia, il Benevento, la Cavese, la Casertana, il Sorrento, la Turris ed altre ancora.	5733	Campania	56	357
Dal punto di vista atletico, la regione ha dato al calcio nazionale ed internazionale diverse figure celebri. I calciatori campani di nota fama in attività sono tra gli altri Antonio Di Natale, Fabio Quagliarella, Marco Borriello, Domenico Criscito, Raffaele Palladino, Simone Barone, Cristian Molinaro, Ignazio Abate, Antonio Nocerino, Salvatore Bocchetti, Ciro Immobile, Lorenzo Insigne e Paolo Cannavaro.	5733	Campania	56	407
La regione conta anche società di altri sport. Di un certo livello è il basket, che annovera importanti club a Caserta, Avellino, Napoli, Agropoli e Scafati. Di rilievo si presenta anche il volley, nel salernitano, nel casertano e nell'avellinese. Ovviamente in regione si praticano anche altre attività sportive, come la pallanuoto, la pallamano, la vela, il rugby e -con la Eagles Salerno- anche il football americano.	5733	Campania	56	420
Medusa e le sue sorelle erano rappresentate come orrende donne con ali d’oro e mani di bronzo, avevano il viso rotondo con intorno i serpenti al posto dei capelli e la bocca abbastanza larga. Prima erano delle ragazze belle ma sempre con serpenti al posto dei capelli.	27058	Medusa_(mitologia)	56	268
Il re Polidette inviò Perseo a uccidere Medusa, pensando di liberarsi di lui per sposare sua mamma Danae. Perseo rintracciò le Graie, togliendo il loro stesso occhio e stesso dente, finché non gli indicassero la dimora delle ninfe. In alcuni racconti prima di partire venne inoltre condotto da Atena a Samo dove la dea gli avrebbe mostrato tre simulacri delle Gorgoni per imparare a riconoscere Medusa dalle sue due sorelle. Le trovò che stavano dormendo e le guardò con il riflesso dello scudo per evitare di essere pietrificato. Perseo riuscì a uccidere Medusa, le due sorelle tentarono di inseguirlo ma questi, invisibile, riuscì a fuggire in groppa a Pegaso, portando con sé la testa di Medusa in un sacco.	27058	Medusa_(mitologia)	56	710
La logica proposizionale è la disciplina che cerca di stabilire con certezza la verità o la falsità delle proposizioni senza incorrere in ambiguità. Ad ogni proposizione è possibile quindi attribuire un solo valore univoco (generalmente 1 o 0).	21559	Logica	56	244
Tutti gli apparecchi elettronici, come ad esempio i computer, le radio, le console per i giochi e i cellulari hanno bisogno di una programmazione che si basa sulla logica. È quindi facile comprendere come questa materia stia diventando sempre più importante.	21559	Logica	56	258
Se, effettivamente una delle navi (o una parte) si trova in quella precisa casella del tabellone, il giocatore attaccato dovrà confermare di essere stato colpito e aspettare il nuovo colpo dell’attaccante. L’attaccante, continuerà seguendo le caselle vicine a dove ha colpito la prima nave, finché non l'avrà affondata. Quando un giocatore sbaglia, il turno passa all'avversario; vince chi per primo riesce ad affondare tutta la corazzata dell’avversario.	21559	Logica	56	455
"Il mese di marzo proclama la fine dell'inverno, infatti il 21 marzo inizia la primavera; è un mese caratterizzato da un'incredibile instabilità atmosferica non a caso uno dei detti più famosi è:""MARZO PAZZERELLO GUARDA IL SOLE E PRENDI L'OMBRELLO""."	12021	Marzo	56	248
Una leva è una macchina semplice, costituita da un corpo rigido girevole attorno a un punto fisso detto fulcro, soggetta all'azione di due forze, la resistenza (R) che è la forza da vincere (ad esempio la resistenza delle forbici sono le lame) e la forza motrice o potenza (P) che è la forza applicata per vincere la resistenza.	15165	Leva_(fisica)	56	328
Si chiama braccio di resistenza la distanza tra il fulcro e il punto di applicazione della resistenza, si chiama braccio della potenza la distanza tra il fulcro e il punto di applicazione della potenza. La lunghezza della leva corrisponde alla somma della lunghezza dei due bracci.	15165	Leva_(fisica)	56	281
In una leva di terza specie le due forze sono applicate dalla stessa parte rispetto al fulcro con la forza resistente posizionata più distante dal fulcro stesso, per il resto il sistema è analogo a quello descritto per le leve di seconda specie.	15165	Leva_(fisica)	56	245
Lo sci di fondo è nato come mezzo di locomozione, grazie all'esigenza dei popoli nordici e asiatici di muoversi agevolmente sulla neve. Se è vero che la necessità aguzza l'ingegno, ecco che per caso o per intuizione geniale, qualcuno cominciò a mettersi sotto i piedi delle cortecce.	15936	Sci_di_fondo	56	283
Con il tempo queste rudimentali racchette da neve subirono una lenta ma costante evoluzione e chi le calzava cominciò, lentamente, a scivolare. I primi sci non erano molto diversi da quelli attuali, ma da alcuni reperti ritrovati in Svezia, si pensa che all'inizio si utilizzassero due sci, tra loro diversi, uno lungo su cui scivolare, l'altro corto, ricoperto di pelle di renna, per spingere e frenare.	15936	Sci_di_fondo	56	404
Le testimonianze che parlano degli sci sono molte, alcune addirittura precedenti la nascita di Cristo. Quelle più recenti, però, ci giungono dai paesi scandinavi. Un evento storico molto importante narra che nel 1520, in Svezia, Gustavo Vasa, un ribelle, stava fuggendo in esilio, quando due uomini con gli sci lo hanno raggiunto per affidargli la guida della rivolta contro la dominazione danese. Epico fu il ritorno di Gustavo da Salen a Mora dove scacciò gli invasori e fu incoronato re di Svezia. In ricordo di questa straordinaria impresa dal 1922 fu istituita una gara di gran fondo, la Vasaloppet, di 90 chilometri che si snoda lungo lo stesso percorso. E solo nel 1843, però, che lo sci di fondo è diventato uno sport. In questa data si disputò la prima gara ufficiale della storia, in Norvegia.	15936	Sci_di_fondo	56	803
Sul finire del XIX secolo lo sci di fondo arriva anche in Italia, precisamente nel 1886, grazie ad Edoardo Mortinori. Dalle valli torinesi, lo sci arrivò in tutte le grandi città del nord e nei primissimi anni del XX secolo furono fondati i primi sci club: Torino, Milano, Genova. Nel 1913 fu fondata a Milano la Federazione Italiana dello Sci.	15936	Sci_di_fondo	56	344
Il 10 ottobre 1920 si ricostituì la FISI (Federazione Italiana Sport Invernali) che nel 1929 si trasferì a Roma. Dal 1962 al 1968 i fondisti italiani si fecero conoscere sulla scena internazionale. Nel 1968 Franco Nones vinse l'oro nella 30 km alle Olimpiadi di Grenoble. Il fondo raggiunse così il pubblico degli sportivi.	15936	Sci_di_fondo	56	323
nel pattinato avviene uno spostamento di peso molto visibile da un lato all'altro del corpo, quindi da una gamba all'altra e in questo stile si usano particolarmente glutei, quadricipiti, polpacci per gli spostamenti di peso, bicipiti e tricipiti per caricare sulle braccia e dare così la spinta che determina la velocità.	15936	Sci_di_fondo	56	322
Sia nella tecnica classica sia nella tecnica libera c'è la contrazione e la distensione di molti muscoli perché per spingere e dare molta forza il muscolo si stende e poi con molta violenza si contrae per dare forza. Per spingere in più si usano gli addominale e il bacino perché per prendere forza il bacino si spinge leggermente in avanti e per scaricare la forza acquisita ci si piega (sempre leggermente) e poi continuamente così per diversi minuti (a volte anche ore). Insieme a tutto questo c'è il piegamento delle gambe che si flettono contemporaneamente al busto per poi distendersi dando più potenza al bacino quando da la spinta per prendere forza. Tutto questo avviene nell'arco di pochi secondi.	15936	Sci_di_fondo	56	707
In questa tecnica parte un concorrente alla volta con una distanza solitamente di 20 secondi l'uno dall'altro. L'ordine di partenza viene fatto tramite sorteggio quindi totalmente casuale e vengono cronometrati i tempo di ciascun concorrente poi vengono controllati e viene fatta la classifica ufficiale.	15936	Sci_di_fondo	56	304
Gli atleti sono in file da massimo 10 persone e il via viene dato attraverso lo sparo di pistola. In questa tecnica la classifica viene fatta dall'ordine di arrivo, queste gare sono con un minimo di 10 km e per questo è possibile (solo da alcuni anni) di cambiare sci durante la gara nelle tappe prestabilite.	15936	Sci_di_fondo	56	309
